,full_text,username,Kategori,created_at,tweet_english
1946,penampilan calon wakil presiden cawapres noinginr urut 3 mahfud mddi debat pilpres 2024 menuai apresiasi tren positif mahfud dinilai tampil memukau meyakinkan debat perdana cawapres digelar jumat 22 desember 2023,__RismaWidiono_,Cawapres,Mon Dec 25 11:37:51 +0000 2023,The appearance of vice presidential candidate vice president noining 3 mahfud mddi presidential election debate 2024 drew the appreciation of the positive trend mahfud was considered to appear stunning to convince the first vice presidential debate held on Friday 22 December 2023
1947,alfaridzys37366 ganjar pranowo pak ganjar membawa keberkahan desa muncang terimakasih pak ganjar hebat ganjar mahfud juara debat,PaingSo48078317,Cawapres,Mon Dec 25 11:59:05 +0000 2023,"Alfaridzys37366 Ganjar Pranowo Pak Ganjar brought the blessing of Muncang Village, thank you Mr. Ganjar Great Ganjar Mahfud champion Debate"
1948,ganjar mahfud calon presiden diharapkan memberikan solusi berbagai permasalahan bangsa kskngenn,ast_phoenixx,Cawapres,Mon Dec 25 11:37:50 +0000 2023,Ganjar Mahfud Presidential Candidate is expected to provide solutions to various problems of the KSKNGENN nation
1949,21 program unggulan ganjar mahfud poin 11 21 tsunami aceh lukas enembe jisoo hujan newcastle nepo baby palestine toinginro boxing day bali pledis pukis bukittinggi,mila_syam67,Cawapres,Tue Dec 26 07:23:01 +0000 2023,21 Featured Program Ganjar Mahfud Points 11 21 Aceh Tsunami Lukas Enembe Jisoo Rain Newcastle Nepo Baby Palestine Toininro Boxing Day Bali Pledis Pukis Bukittinggi
1950,elihat indo ohmahfudmd support selalu pak mahfud penampilan luar biasa debat kemarin,putra_kenz37953,Cawapres,Mon Dec 25 11:37:47 +0000 2023,See Indo @mohmahfudmd Support Always Mr. Mahfud's Extraordinary Performance of the Debate yesterday
1951,lukas enembe siang tsunami aceh newcastle hujan kiky boxing day home alone bali macetnya nepo baby palestine jogja pukis fuji siwon unfoll bukittinggi,Mah_fud_Ku,Cawapres,Tue Dec 26 07:22:17 +0000 2023,Lukas Enembe Siang Tsunami Aceh Newcastle Rain Kiky Boxing Day Home Alone Bali traffic jams Nepo Baby Palestine Jogja Pukis Fuji Siwon Unfoll Bukittinggi
1952,12uin akifathoni gmn tokoh 1 doyan bokep 2 angka kemiskinan daerah dipimpinnya 10th termasuk terendah se indonesia 3 baperab 4 einginsian sama aj kyk geinginysian 5 g ad gagasan ap2 ngandelin jokowi mahfud 6 bawa istrinya pns jd jurkam,timoadjie,Cawapres,Mon Dec 25 11:59:01 +0000 2023,12UIN AKIFFFATHONI GMN Figure 1 Doyan Bokep 2 Regional poverty rates He led 10th including the lowest in Indonesia 3 BAPRAB 4 EINTASIAN AJ KYK GEINTYSIAN 5 G AD AP2 Ideas Ngandelin Jokowi Mahfud 6 Bring his wife PNS Jurkam
1953,wagimandeep212 ganjar pranowo hebat ganjar mahfud juara debat,khellafikadda,Cawapres,Mon Dec 25 11:37:40 +0000 2023,Wagimandeep212 Ganjar Pranowo Great Ganjar Mahfud Champion Debate
1954,yang benar2 pendukung jokowi ada kata2 bingung ataupun jelas hebat ganjar mahfud juara debat,JakubSzwak,Cawapres,Tue Dec 26 07:22:11 +0000 2023,The truth is that Jokowi's supporters are confused or clear words Ganjar Mahfud champions the debate
1955,ganjar mahfud inovasi keberanian adalah kunci kesuksesan di berbagai jabatan hyuxdz13,PermaaIndah,Cawapres,Mon Dec 25 11:58:59 +0000 2023,Ganjar Mahfud Innovation Courage is the key to success in various positions Hyuxdz13
1956,elihat indo jelas beda menghafal ada arahan sama proses gagasan ada isi kepala ganjar mahfud paling oke,PratamaJul9960,Cawapres,Tue Dec 26 07:22:02 +0000 2023,"Elihat Indo is clearly different about memorizing there is a direction with the process of ideas, there is the contents of the head of Ganjar Mahfud"
1957,pak sangat berani mantap euy hebat ganjar mahfud debat,D4ng3rG,Cawapres,Mon Dec 25 11:37:37 +0000 2023,"Sir, I really dare to be great, Ganjar Mahfud Debate"
1958,ganjar mahfud pemimpin berkomitmen menjaga keutuhan nkri wawazsy,DoniHidaya7,Cawapres,Mon Dec 25 11:58:44 +0000 2023,Ganjar Mahfud Leader is committed to maintaining the integrity of the Republic of Indonesia Wawazsy
1959,ganjar mahfud gubernur selalu berkomitmen meningkatkan kesejahteraan masyarakat jatim ovedaiv,SindiS74,Cawapres,Mon Dec 25 11:58:43 +0000 2023,Ganjar Mahfud Governor is always committed to improving the welfare of the people of East Java OVEDAIV
1960,45 persen misi visi pasangan ganjar mahfud didukung rakyat link,WawanKu08354672,Cawapres,Tue Dec 26 07:21:58 +0000 2023,45 percent of the mission of the vision of the pair Ganjar Mahfud is supported by the People's Link
1961,ganjar mahfud pemimpin tidak bicara juga bertindak nyata ullyminnie,fiercephoe48393,Cawapres,Mon Dec 25 11:37:31 +0000 2023,"Ganjar Mahfud, the leader did not talk to Ullyminnie's real act"
1962,mahfud md ganjar mahfud tokoh memiliki tekad kuat memajukan negeri dit,Saskiaputrix,Cawapres,Mon Dec 25 11:58:37 +0000 2023,Mahfud MD Ganjar Mahfud Figure has a strong determination to advance the country Dit
1963,elihat indo ohmahfudmd terbaik pak mahfud menang telak cawapres lain,Ndawung12,Cawapres,Mon Dec 25 11:36:57 +0000 2023,See Indo @mohmahfudmd the best Mr. Mahfud won another vice presidential candidate
1964,urawa isu pki lenyap isu ijazah palsu leyap isu asang aseng asing lenyap isu haram ngucapin natal lenyap sudah sekolam ganjar mahfud gaasss pooolllll,Dev_Haryanto,Cawapres,Tue Dec 26 07:21:12 +0000 2023,Urawa PKI issue disappeared the issue of fake diploma leyap the issue of foreign aseng disappeared issues of illicit Christmas disappeared.
1965,kumparan setia dukung capres no 3 m3nang semangat pal pak inginhmahfudmd yakin m3nang hebat ganjar mahfud debat,DarkSamaa,Cawapres,Mon Dec 25 11:36:55 +0000 2023,Loyal Coils Support Presidential Candidates No. 3 M3NANG PAL PAL SPIRIT WANTS HUMAHFUDMD BELIEVE M3NANG Great Ganjar Mahfud Debate
1966,ganjar mahfud dianggap pemimpin dapat menjalankan roda pemerintahan transparan akuntabel rdan962,JawartaJor1,Cawapres,Mon Dec 25 11:58:37 +0000 2023,Ganjar Mahfud is considered a leader to run a transparent accountable government wheel RDAN962
1967,indikator prabowo gibran 46 7 ganjar mahfud 24 5 anies cak imin 21,kumparan,Cawapres,Tue Dec 26 07:21:09 +0000 2023,Prabowo Gibran 46 Indicator 7 Ganjar Mahfud 24 5 Anies Cak Imin 21
1968,entangnegeri ompastv bukan ga terima tpi caranya yang licik sengaja memalukan lawan cak imin pak mahfud kaget lah ko gitu maenya dah ga nyambung songong,ally74768831,Cawapres,Mon Dec 25 11:36:55 +0000 2023,"about the country of compastv not not accepting but the cunning way deliberately embarrassing against Cak Imin Mr. Mahfud is shocked, how come he doesn't connect Songong"
1969,ganjar pranowo selamat hut tni 78 garda terdepan negeri hebat ganjar mahfud juara debat,Peterson_Cliff,Cawapres,Mon Dec 25 11:58:37 +0000 2023,Ganjar Pranowo Happy Anniversary of TNI 78 Leading Garda Great Country Ganjar Mahfud Champion Debate
1970,joker wedoks ganjar pranowo pdi perjuangan jokowi terus kembangkan ide gagasan mu kebaikan indonesia pak hebat ganjar mahfud juara debat,Husejnovich1,Cawapres,Tue Dec 26 07:21:07 +0000 2023,Joker Wedoks Ganjar Pranowo PDI Perjuangan Jokowi continues to develop your ideas of your good Indonesian Pak Great Ganjar Mahfud champion Debate
1971,dukungan masyarakat ganjar mahfud mahfud md semakin solid mereka dianggap pemimpin mampu menghadapi dinamika global runkenmaryy,lynnelvnne,Cawapres,Mon Dec 25 11:36:53 +0000 2023,Ganjar Mahfud Mahfud MD community support is increasingly solid they are considered leaders to be able to face the dynamics of global runkenmaryy
1972,cawapres 2024 mahfud md menyambangi gereja katedral jakarta minggu 24 12 2023 ingin memastikan tempat peribadatan umat kristiani aman inginmentum natal 2023 nya semua agama mengajarkan kebaikan persaudaraan kerukunan antarsesama umat manusia,Jo_andre0809,Cawapres,Tue Dec 26 07:21:06 +0000 2023,Vice President 2024 Mahfud MD visited the Jakarta Cathedral Church Sunday 24 12 2023 wanted to ensure the place of worship of Christians Aman Utaramentum Christmas 2023 all religions teach the goodness of the brotherhood of harmony among humanity
1973,ganjar mahfud gubernur membuktikan integritasnya pernah tergoyahkan vrizakaniaa,PradiktaRa,Cawapres,Mon Dec 25 11:58:26 +0000 2023,Ganjar Mahfud Governor proves his integrity has been shaken by Vrizakaniaa
1974,mas ganjar mahfud figur bisa merangkul keberagaman mempersatukan seluruh elemen masyarakat zkyboi,cempaka_binar,Cawapres,Mon Dec 25 11:36:31 +0000 2023,Mas Ganjar Mahfud Figur can embrace the diversity of uniting all elements of the Zkyboi society
1975,politisi pengusaha busuk kini bersatu melawan ganjar mahfud ganjar mahfud menang politisi pengusaha busuk hidupnya gelisah dihantui perilakunya korup yang suka menyuap ganjar mahfud menang keadilan hukum rakyat kecil akan lebih terjamin,brahmanta_70,Cawapres,Mon Dec 25 11:58:15 +0000 2023,Politician Rotten Entrepreneur is now united against Ganjar Mahfud Ganjar Mahfud won the politician of the rotten businessman's restless life is haunted
1976,urrangawak ngkongroses seruanhl antoniuscdn b3doel ganjar pranowo denni sauya even1508 tidak melupakan guru pahlawan tanda jasa ganjar paling mengerti hebat ganjar mahfud juara debat,JameliaTasma,Cawapres,Tue Dec 26 07:21:00 +0000 2023,Urangawak Ngkongrosses Antonius CDN B3 Doel Ganjar Pranowo Denni Saiya EVEN1508 Does not forget the heroes of Ganjar's heroes Ganjar Most Understanding Ganjar Mahfud Champion Debate Champion
1977,duh mahfud md ternyata pernah langgar etika jadi ketua mk,badrudin1074534,Cawapres,Mon Dec 25 11:36:30 +0000 2023,Duh Mahfud MD apparently had violated ethics to become the chairman of the Constitutional Court
1978,iki daliyo pak mahfud selalu menjadi sosok hebat mata masyarakat rekam jejak baik,pales_rio,Cawapres,Tue Dec 26 07:20:58 +0000 2023,Iki Daliyo Pak Mahfud has always been a great figure of the eyes of the good track record
1979,dukungan rakyat ganjar mahfud cermin keinginan pemimpin visioner ctamtlu,tiar4rmdnii,Cawapres,Mon Dec 25 11:58:12 +0000 2023,Support of the people of Ganjar Mahfud Mermin
1980,dukungan masyarakat ganjar mahfud mahfud md mencerminkan keinginan kepemimpinan inklusif ryzenie,ragaangkasaaaa,Cawapres,Mon Dec 25 11:58:11 +0000 2023,Community support Ganjar Mahfud Mahfud MD reflects the desire of Ryzenie's inclusive leadership
1981,ganjar mahfud gubernur progresif membawa inovasi pembangunan nasional ittlemawarr,MayangSari11ii,Cawapres,Mon Dec 25 11:36:26 +0000 2023,Ganjar Mahfud Progressive Governor brought innovation in the National Development of ITTlemawarr
1982,kiki daliyo ganjar pranowo pemimpin merangkul semua memandang suku ras budaya agama hebat ganjar mahfud juara debat,JakubSzwak,Cawapres,Tue Dec 26 07:20:52 +0000 2023,Kiki Daliyo Ganjar Pranowo The leader embraced all looking at the Race of the Great Religious Culture Ganjar Mahfud Champion Debate
1983,ganjar mahfud meski pernah mendampingi jokowi mampu membangun citra kepemimpinan independen berwibawa aeraessgf,MuhammadFi90852,Cawapres,Mon Dec 25 11:58:10 +0000 2023,"Ganjar Mahfud, although he once accompanied Jokowi to be able to build an independent leadership image of authoritative aeraessgf"
1984,uhutsitompul ganjar mahfud koruptor dihukum mati,bengnano1,Cawapres,Tue Dec 26 07:20:47 +0000 2023,Ruhut Sitompul Ganjar Mahfud Corruptor was sentenced to death
1985,ganjar mahfud gubernur sukses kini siap membawa pengalamannya kemajuan indonesia bersama mahfud md wakil presiden bgj j,nadiraslma_,Cawapres,Mon Dec 25 11:36:24 +0000 2023,Ganjar Mahfud Governor Successful is now ready to bring his experience in progress Indonesia with Mahfud MD Vice President BGJ J
1986,iki daliyo jadi sejauh ada pro kontra penilaian mahfud md cawapres rekam jejak kinerja baiknya perlu diapresiasi pelanggaran konstitusi jelas menjadi catatan tidak diabaikan,_Lonamaya,Cawapres,Tue Dec 26 07:20:41 +0000 2023,"Iki Daliyo so as far as there is a pros and cons of the assessment of Mahfud MD Vice President, the good performance track record needs to be appreciated by the constitutional violation clearly into a note that is not ignored"
1987,ganjar pranowo univ pasundan mantaps pak ganjar terimakasih semangat supportnya mahasiswa baru hebat ganjar mahfud juara debat,PrajwalKhairna9,Cawapres,Mon Dec 25 11:58:06 +0000 2023,"Ganjar Pranowo Univ Pasundan Mantaps Pak Ganjar Thank you for the spirit of Support, Great New Student Ganjar Mahfud Champion Debate"
1988,mas ganjar mahfud pemimpin merakyat selalu mendengarkan aspirasi masyarakat siap memperjuangkan kepentingan rakyat etrojamess,dewinngsh_,Cawapres,Mon Dec 25 11:36:22 +0000 2023,"Mas Ganjar Mahfud, the leader of the population always listening to the aspirations of the people ready to fight for the interests of the people of Etrojamess"
1989,ongernite ompastv lah trik cmn sdit lt gw kemaren denger nya selanjut nya trik ampas bongkar cak imin ama mahfud md bukan nya sadar malah nge gass lucu lah,gamegg15112976,Cawapres,Mon Dec 25 11:58:06 +0000 2023,"Ondernite Ompastv is the trick cmn SDIT LT I heard it yesterday, the next trick to dismantle Cak Imin and Mahfud MD was not aware that it was funny, it was funny"
1990,kepemimpinan ganjar mahfud menunjukkan keberhasilan politik dicapai mengutamakan kepentingan bersama hhaotung,AuroraSkye48514,Cawapres,Mon Dec 25 11:36:21 +0000 2023,Ganjar Mahfud's leadership showed that political success was achieved prioritizing the shared interests of Hhaotung
1991,iki daliyo mahfud md tetap terbaik gaspol brantas korupsi,PratamaJul9960,Cawapres,Tue Dec 26 07:19:22 +0000 2023,Iki Daliyo Mahfud MD remains the best Gaspol Brantas Corruption
1992,ganjar mahfud pemimpin dapat meingintivasi masyarakat aktif pembangunan negara iatun,SriSusi7ilawati,Cawapres,Mon Dec 25 11:58:05 +0000 2023,"Ganjar Mahfud, the leader can invest the active community of the development of the country"
1993,saatnya diwajibkan rumah rss rumah jokowi berupa ruko meningkatkan ekonomi rakyat uxjyybznyc hebat ganjar mahfud juara debat,Husejnovich1,Cawapres,Tue Dec 26 07:18:22 +0000 2023,It's time to be required to be a house RSS Jokowi's house in the form of a shop to improve the economy of the people of Uxjyybznyc Great Ganjar Mahfud Champion Debate
1994,oloposdotcom tetap dukung ganjar mahfud,erlithaj20,Cawapres,Mon Dec 25 11:36:20 +0000 2023,Solopos Dotcom continues to support Ganjar Mahfud
1995,ganjar mahfud pemimpin berfokus pemberdayaan perempuan anak anak amaisjune,HadiPrasod55,Cawapres,Mon Dec 25 11:36:19 +0000 2023,Ganjar Mahfud Leader Focusing on Empowering Women's Children Amaisjune Children
1996,vonenews anies muhaimin batalkan ikn prabowo gibran lanjutkan ikn ganjar mahfud lanjutkan ikn,BatukKeras_Batu,Cawapres,Mon Dec 25 11:58:00 +0000 2023,Vonews Anies Muhaimin Cancel IKN Prabowo Gibran Continuing IKN Ganjar Mahfud Continuing IKN
1997,dwi tunggal ganjar mahfud indonesia lebih baik palestine kiky tsunami aceh lee haechan siwon unfoll bali pledis bukittinggi home alone pukis sbux gmmtv doyoung nepo baby,ghinaua22075,Cawapres,Tue Dec 26 07:18:03 +0000 2023,Dwi Tunggal Ganjar Mahfud Indonesia Better Palestine Kiky Tsunami Aceh Lee Haechan Siwon Unfoll Bali Pledis Bukittinggi Home Alone Pukis SBUX GMMTV Doyoung Nepo Baby
1998,ganjar mahfud dilihat pemimpin akan mendukung kemajuan sektor pariwisata indonesia hafa15242539,satyapangestuu,Cawapres,Mon Dec 25 11:36:15 +0000 2023,Ganjar Mahfud seen by the leader will support the progress of the Indonesian Tourism Sector Hafa15242539
1999,ganjar mahfud pemimpin dapat menciptakan regulasi pro investor mendukung pertumbuhan ekonomi ookviewszz,nabilaauli62530,Cawapres,Mon Dec 25 11:57:58 +0000 2023,Ganjar Mahfud Leaders can create pro investor regulations supporting economic growth ookviewszz
2000,tpn ganjar pranowo mahfud md merespons sikap cawapres gibran rakabuming raka meninggalkan podium bersorak debat kedua,yuliakhmada,Cawapres,Tue Dec 26 07:18:03 +0000 2023,TPN Ganjar Pranowo Mahfud MD responded to the attitude of Vice President Gibran Rakabuming Raka leaving the second debate podium
2001,kinerja ganjar mahfud jatim menciptakan perekonomian kuat berkelanjutan vidiar,suyonorhmat,Cawapres,Mon Dec 25 11:57:58 +0000 2023,The performance of Ganjar Mahfud East Java created a strong economic economy
2002,kepala desa terlibat kasus dana desa ganjar mahfud menunjukkan sikap tegas korupsi pelanggaran hukum hoirun86676709,robizaki97,Cawapres,Mon Dec 25 11:36:15 +0000 2023,The Village Head was involved in the Village Fund case Ganjar Mahfud showed a firm attitude of corruption violations of Hoirun 86676709
2003,irindatanglagi anjarpranowo kecurangan bisa mengalahkan ganjar mahfud pilpres 2024,Cyko_as_Coky,Cawapres,Tue Dec 26 07:17:58 +0000 2023,@Airindatanglagi Ganjar Pranowo cheating can beat Ganjar Mahfud Pilpres 2024
2004,ganjar pranowo pilih pemimpin yang punya solusi mengatasi masalah bukan menambah masalah ganjar tulus melayani hebat ganjar mahfud juara debat,JakubSzwak,Cawapres,Mon Dec 25 11:36:11 +0000 2023,Ganjar Pranowo Choose a Leader who has a solution to overcome the problem instead of adding to the problem of Ganjar Tulus serving the great Ganjar Mahfud Champion Debate
2005,keberanian ganjar mahfud bersaing tingkat nasional menunjukkan beliau memiliki tekad kuat berbuat lebih baik analeylo,atikahmand91052,Cawapres,Mon Dec 25 11:57:55 +0000 2023,Ganjar Mahfud's courage to compete at the national level shows that he has a strong determination to do better analeylo
2006,iki daliyo mahfud md memang punya cara bicara khas tajam peluru tak terkendali sindiran menyentil tegas keren,BimaAntara12,Cawapres,Tue Dec 26 07:17:48 +0000 2023,Iki Daliyo Mahfud MD does have a typical way of speaking sharp bullets uncontrolled satire shot firmly cool
2007,mahfud md komitmennya mengatasi masalah korupsi tegas ancokstfu,arkakusumaax,Cawapres,Mon Dec 25 11:36:10 +0000 2023,Mahfud MD Commitment to Overcome the Problem of Corruption Firm Ancokstfu
2008,kiki daliyo ganjar pranowo bersama merawat nilai pancasila fnysuljrqb hebat ganjar mahfud juara debat,Hikmet19326295,Cawapres,Tue Dec 26 07:17:41 +0000 2023,Kiki Daliyo Ganjar Pranowo together to care for the value of Pancasila Fnysuljrqb Great Ganjar Mahfud Champion Debate
2009,calon wakil presiden noinginr urut 3 mahfud md menyinggung pilihan kandidat pilpres 2024 menurutnya pemilih jangan menjatuhkan pilihan semata mata terbuai jargon,kaddafong,Cawapres,Mon Dec 25 11:57:54 +0000 2023,Candidate Vice President Noiningr Sort 3 Mahfud MD alluded to the choice of the 2024 presidential election candidate according to him not to make a choice
2010,ganjar pranowo mahfud md bakal memprioritaskan isu perempuan program kerjanya,okezonenews,Cawapres,Mon Dec 25 11:57:43 +0000 2023,Ganjar Pranowo Mahfud MD will prioritize the issue of women's work programs
2011,keberhasilan ganjar mahfud gubernur dukungan jokowi menciptakan optimisme potensi kepemimpinan beliau tingkat nasional ausprites,Putriintansr1,Cawapres,Mon Dec 25 11:36:06 +0000 2023,The success of Ganjar Mahfud Governor Jokowi support created the optimism of his leadership potential at the National Level Ausprites
2012,elihat indo pilihanku tetap no 3 ganjar mahfud 2024,rioaprizal01,Cawapres,Tue Dec 26 07:17:37 +0000 2023,Elihat Indo My Choice remains No. 3 Ganjar Mahfud 2024
2013,vonnycornellya sistematis amp terstruktur sis hebat ganjar mahfud debat,D4ng3rG,Cawapres,Mon Dec 25 11:36:06 +0000 2023,Vonnycornellya Systematic AMP Structured Sis Great Ganjar Mahfud Debate
2014,ganjar mahfud gubernur memahami mampu mengatasi kompleksitas tugas tugas kepemimpinan ambemuhhh,wibianiaz12,Cawapres,Mon Dec 25 11:57:41 +0000 2023,Ganjar Mahfud Governor understands able to overcome the complexity of Ambemuhhh leadership tasks
2015,iki daliyo pokoknyaa pak mahfud sangat memiliki pengalaman baik bagus membangun negeri,rioaprizal01,Cawapres,Tue Dec 26 07:16:57 +0000 2023,"Iki Daliyo Anyway, Mr. Mahfud has a good good experience in developing the country"
2016,ganjar pranowo bersama pak ganjar makin haringinnis hebat ganjar mahfud juara debat,Husejnovich1,Cawapres,Tue Dec 26 07:16:54 +0000 2023,Ganjar Pranowo with Mr. Ganjar is increasingly Haringinnis Great Ganjar Mahfud Champion Debate
2017,ganjar mahfud membawa semangat persatuan dunia politik sering kali diwarnai perpecahan idfr0mbasement,wahyufathonii,Cawapres,Mon Dec 25 11:57:40 +0000 2023,Ganjar Mahfud brings the spirit of political unity of the world is often colored by the division of IDFR0MBasement
2018,ganjar mahfud pemimpin memiliki kepekaan kebutuhan masyarakat kurang mampu arwosaifu34819,indira_mika,Cawapres,Mon Dec 25 11:36:05 +0000 2023,Ganjar Mahfud Leaders have the sensitivity of the needs of the underprivileged of Arwosaifu34819
2019,ganjar pranowo semakin bangga pak ganjar pranowo benar benar memprioritaskan rakyat kecil the real tuanku rakyat hebat ganjar mahfud juara debat,Hikmet19326295,Cawapres,Tue Dec 26 07:16:05 +0000 2023,Ganjar Pranowo is increasingly proud that Mr. Ganjar Pranowo really prioritizes the little people of The Real Tuanku Great People Ganjar Mahfud Champion Debate
2020,ganjar mahfud gubernur campur tangan jokowi menunjukkan kompetensinya ummyscheek,syahnalaaxav,Cawapres,Mon Dec 25 11:36:04 +0000 2023,Ganjar Mahfud Governor Intervening Jokowi showed his competence UmMyscheek
2021,warga jatim yakin ganjar mahfud mahfud md menjadi pemimpin membawa era baru indonesia rxxm zzz,ridhoulam,Cawapres,Mon Dec 25 11:57:35 +0000 2023,East Java citizens believe that Ganjar Mahfud Mahfud MD is the leader to bring the new era of Indonesia RXXM ZZZ
2022,aseeeekkk neehh gaeess hebat ganjar mahfud juara debat,omerzarali39,Cawapres,Mon Dec 25 11:57:33 +0000 2023,Aseeeekkk neehh Gaeess Great Ganjar Mahfud Champion Debate
2023,ganjar mahfud dianggap pemimpin dapat membawa semangat baru dunia politik terbukti prestasinya gubernur jokowi avsoulmate,SaputIksan,Cawapres,Mon Dec 25 11:36:03 +0000 2023,Ganjar Mahfud is considered a leader to bring a new spirit of the political world proven by Governor Jokowi Avsoulmate's achievements
2024,ganjar mahfud membuktikan dia mampu mengemban tanggung jawab baik velllll,harryyyy8_,Cawapres,Mon Dec 25 11:36:03 +0000 2023,Ganjar Mahfud proved he was able to carry out the good responsibilities of Velllll
2025,dukungan warga jatim ganjar mahfud mencerminkan dukungan besar kepemimpinan berintegritas pehhsng,endimanan731,Cawapres,Mon Dec 25 11:57:18 +0000 2023,East Java residents' support Ganjar Mahfud reflects the great support of leadership with integrity pehhsng
2026,ganjar pranowo rosianna766hi alam ganjar sangat cerdas dalam menanggapi soal politik kekuasan hebat ganjar mahfud juara debat,Peterson_Cliff,Cawapres,Mon Dec 25 11:57:17 +0000 2023,Ganjar Pranowo Rosianna766Hi Alam Ganjar is very smart in responding to the political issue of Ganjar Mahfud's great power champion Debate
2027,ganjar mahfud pilihan dapat membawa keberlanjutan kemajuan negara hana33,arvinalvaro9,Cawapres,Mon Dec 25 11:36:01 +0000 2023,Ganjar Mahfud Electives can bring the sustainability of the progress of the country of Hana33
2028,salah tuduh mbak unungmar1404 lapas dibawah kemenkumham menterinya kader pdip menkopolhukam nya jadi cawapres pdip bongkar bisnis lapas anak yasonna laoly mahfud ngeles bilang masalah sederhana makanya kami panggil rm sederhana,PartaiSocmed,Cawapres,Mon Dec 25 11:57:13 +0000 2023,"One of the accusations of Mbak Unungmar1404 Lapas under the Ministry of Law and Human Rights, the cadre of PDIP Menkopolhukam, is the vice presidential candidate for dismantling the business of Lapas, Yasonna Laoly, Mahfud, said that we called a simple RM."
2029,keberhasilan ganjar mahfud dpr keterlibatan jokowi menciptakan keyakinan beliau memiliki wawasan politik matang ayqra,amadbasri_,Cawapres,Mon Dec 25 11:35:59 +0000 2023,The success of Ganjar Mahfud DPR's involvement in creating his belief in having the Ayqra mature political insight
2030,antorinissun pemimpin selanjutnyaa ganjar mahfud terbaikkk,cihuycika,Cawapres,Mon Dec 25 11:35:59 +0000 2023,@santorinissun next leader Ganjar Mahfud the best
2031,ganjar mahfud membuktikan keberhasilan politik diraih melibatkan seluruh elemen masyarakat hoirotulmazida,setooogalang,Cawapres,Mon Dec 25 11:35:58 +0000 2023,Ganjar Mahfud proved that political success was achieved involving all elements of the Hoirotulmazida society
2032,ganjar mahfud gubernur mengedepankan keberlanjutan lingkungan pembangunan jatim oveeejojojo,ari6828851,Cawapres,Mon Dec 25 11:35:53 +0000 2023,Ganjar Mahfud Governor put forward the sustainability of the East Java Oveejojojo development environment
2033,masyarakat jatim melihat ganjar mahfud sosok bisa membawa perubahan nyata uemulki,jidanamir_,Cawapres,Mon Dec 25 11:35:51 +0000 2023,"East Java people see Ganjar Mahfud, a figure can bring a real change in Uemulki"
2034,ganjar mahfud sosok berhasil terus bergantung jokowi memberikan inspirasi positif pemimpin muda ntrovertatiq,AprilianiS46,Cawapres,Mon Dec 25 11:35:50 +0000 2023,Ganjar Mahfud Figure managed to continue to depend on Jokowi giving positive inspiration for young leaders ntrovertatiq
2035,kepemimpinan ganjar mahfud membuktikan keberhasilan politik diraih mengutamakan kepentingan rakyat honsuuv,gbrnrmdannn,Cawapres,Mon Dec 25 11:35:47 +0000 2023,Ganjar Mahfud's leadership proved that political success was achieved prioritizing the interests of the people of Honsuuv
2036,ganjar mahfud membuktikan kesuksesan politiknya terbatas keterlibatan jokowi hasil dedikasi kompetensinya avgirll 0,ameliaamd,Cawapres,Mon Dec 25 11:35:46 +0000 2023,Ganjar Mahfud proves that his political success is limited to Jokowi's involvement resulting from the dedication of his competence Avgirll 0
2037,ganjar mahfud membuktikan keberhasilan politik diraih harus melibatkan diri praktik praktik etis hairulridhwane,RamadhanAbdlh,Cawapres,Mon Dec 25 11:35:42 +0000 2023,Ganjar Mahfud proved that political success was achieved must involve himself in the practice of ethical hairulridhwane
