,full_text,username,Kategori,created_at,tweet_english
1220,keakraban mas ganjar anak anaknya memberikan harapan generasi muda cerdas berdedikasi wanlake33 gp 4presiden,Rangga0setiawan,Capres,Fri Dec 15 10:36:06 +0000 2023,The familiarity of Mas Ganjar's children gives hope that the young generation is intelligent dedicated
1221,ganjar pranowo pemimpin dapat menciptakan kebijakan sesuai kebutuhan rakyatnya oobkuna gp 4presiden,Rismasnst1,Capres,Fri Dec 15 10:36:06 +0000 2023,Ganjar Pranowo Leaders can create policies according to the needs of his people Oobkuna GP 4PRESIDEN
1222,ganjar pranowo mahfud md pasangan dapat merangkul keragaman mempersatukan bangsa illar212 gp 4presiden,AnisaFi47182956,Capres,Fri Dec 15 10:36:06 +0000 2023,Ganjar Pranowo Mahfud MD couples can embrace the diversity of uniting the Illar212 GP 4PRESIDEND
1223,keakraban mas ganjar anak anaknya menggambarkan keluarga prioritas utama bahkan seorang pemimpin ummerrins gp 4presiden,JamalAlvar6,Capres,Fri Dec 15 10:36:04 +0000 2023,The familiarity of Mas Ganjar's children described the top priority family even a leader of Ummerrins GP 4Presiden
1224,ganjar pranowo seinginga kehangatan keluarga menjadi pilar utama membangun jatim inklusif berkeadilan hewirjos gp 4presiden,mnhasanah,Capres,Fri Dec 15 10:36:04 +0000 2023,Ganjar Pranowo Seinginga The warmth of the family became the main pillar of building an Inclusive East Java with a Fair Hewirjos GP 4PRESIDENID
1225,seinginga kebersamaan keluarga ganjar pranowo menular seluruh masyarakat indonesia tatusdilema gp 4presiden,__muhfarhannn,Capres,Fri Dec 15 10:36:04 +0000 2023,Seinginga together with the family of the Ganjar Pranowo family is transmitted by the entire Indonesian community TatusDilema GP 4PRESIDENID
1226,sukses ganjar pranowo mendidik anak anaknya menjadi bukti kepemimpinan dimulai rumah ykimjeong gp 4presiden,raditaayuuuu,Capres,Fri Dec 15 10:36:03 +0000 2023,Success Ganjar Pranowo educating his children is proof of leadership starting with YKIMJEONG GP 4PRESIDENVE HOME
1227,keakraban ganjar pranowo keluarganya menciptakan aura positif sangat diperlukan menjalankan pemerintahan jakarta idancoek gp 4presiden,goddess_pl33557,Capres,Fri Dec 15 10:36:03 +0000 2023,"The familiarity of Ganjar Pranowo, his family, created a positive aura, it was necessary"
1228,rihati utami happiest birthday alam ganjar seinginga mimpi mimpi besarmu tercapai satu persatu,420rupiah,Capres,Fri Dec 15 10:36:02 +0000 2023,Rihati Utami Happiest Birthday Alam Ganjar Seinginga Your Dream Big Dream is achieved one by one
1229,video kebersamaan keluarga ganjar pranowo memberikan harapan kehidupan pribadi seimbang menciptakan pemimpin lebih baik oeyva gp 4presiden,JesikaaPutrii,Capres,Fri Dec 15 10:36:02 +0000 2023,Video Togetherness of the Ganjar Pranowo family gives hope of a balanced personal life creating a better leader Oeyva GP 4Presiden
1230,seinginga kehangatan keluarga ganjar pranowo menjadi pembawa harapan kemajuan indonesia taykrna gp 4presiden,ErlanaJulianti,Capres,Fri Dec 15 10:36:02 +0000 2023,Seinginga The warmth of the Ganjar Pranowo family became a carrier of the hope of the progress of Indonesia Taykrna GP 4PRESIDENA
1231,ganjar pranowo bukan punya visi juga bermain hati dukungan warga jateng semakin membuat langkahnya menuju istana semakin mantap ananna an gp 4presiden,__psimanjuntak,Capres,Fri Dec 15 10:36:02 +0000 2023,Ganjar Pranowo does not have a vision also playing the heart of the support of Central Java residents increasingly making his steps towards the Palace more solid Ananna and GP 4Presiden
1232,kedekatan ganjar pranowo anak anaknya mengajarkan arti pentingnya pendidikan keluarga ilal chibi gp 4presiden,SilkaApriilia,Capres,Fri Dec 15 10:36:01 +0000 2023,The proximity of Ganjar Pranowo's children teach the importance of the education of the Ilal Chibi GP 4presiden family
1233,seinginga kepemimpinan ganjar pranowo membawa indonesia menuju keberlanjutan kemajuan ijihkuacih gp 4presiden,PNunik75785,Capres,Fri Dec 15 10:36:00 +0000 2023,Seinginga The leadership of Ganjar Pranowo brought Indonesia to the sustainability of the progress of Ijihkuacih GP 4PRESIDENID
1234,ganjar pranowo mahfud md memberikan contoh konkret kebersamaan keluarga menjadi landasan kepemimpinan baik wistercookies gp 4presiden,deviasariii1,Capres,Fri Dec 15 10:35:59 +0000 2023,Ganjar Pranowo Mahfud MD gave a concrete example of family togetherness to be the foundation of the good leadership of the 4presiden GP Wistercookies
1235,mas ganjar pranowo hanya menciptakan kebahagiaan keluarganya juga hati banyak warga jatim yakin beliau membawa perubahan positif ahudahan gp 4presiden,wijayaa_dani,Capres,Fri Dec 15 10:35:59 +0000 2023,Mas Ganjar Pranowo only created the happiness of his family as well as the hearts of many East Java residents believe he brought positive change
1236,sukses selalu mas ganjar pranowo pak mahfud md seinginga kepemimpinan membawa kebaikan kebahagiaan indonesia endoksutil gp 4presiden,reyhandamar_,Capres,Fri Dec 15 10:35:59 +0000 2023,Success is always Mas Ganjar Pranowo Pak Mahfud MD Seinginga leadership brings the good happiness
1237,keakraban ganjar pranowo keluarganya menciptakan citra pemimpin humanis emybaby1134 gp 4presiden,annisyawlin,Capres,Fri Dec 15 10:35:58 +0000 2023,"The familiarity of Ganjar Pranowo, his family created the image of the Humanist EMYBABY1134 GP 4PRESIDENID"
1238,video kemesraan keluarga mas ganjar menjadi bukti seorang pemimpin sejati hanya mementingkan diri sendiri juga kebahagiaan orang orang sekitarnya heburnof gp 4presiden,RudiSetiawann99,Capres,Fri Dec 15 10:35:58 +0000 2023,Video of the intimacy of the family of Mas Ganjar is proof that a true leader is only concerned with himself as well as the happiness of the people around him
1239,kebersamaan keluarga ganjar pranowo cerminan kepemimpinan melibatkan hati nurani empati kebutuhan rakyat orkid gp 4presiden,SutraNanan9252,Capres,Fri Dec 15 10:35:57 +0000 2023,Ganjar Pranowo's family together with a reflection of leadership involving the conscience of the empathy needs
1240,jakarta butuh pemimpin ganjar pranowo tidak membuat kebijakan pintar juga bisa menciptakan kehangatan tengah masyarakat idofabian gp 4presiden,LusianaWij4w,Capres,Fri Dec 15 10:35:57 +0000 2023,Jakarta Needs Leaders Ganjar Pranowo does not make smart policies can also create the middle warmth of the Idofabian GP 4Presiden community
1241,mas ganjar pak mahfud diharapkan membawa perubahan positif kemajuan signifikan itiarbiyati gp 4presiden,hupaditriiiiii,Capres,Fri Dec 15 10:35:57 +0000 2023,Mas Ganjar Pak Mahfud is expected to bring positive changes in the significant progress of ITIARBIYATI GP 4Presiden
1242,kemesraan keluarga ganjar pranowo bukti cinta kasih sayang menjadi kekuatan memimpin nowsugary gp 4presiden,jayadamar161182,Capres,Fri Dec 15 10:35:56 +0000 2023,Ganjar Pranowo's family intimacy proof of love becomes the strength to lead the nowsugary gp 4presiden
1243,ganjar pranowo teladan kepemimpinan mengakar nilai nilai keluarga dukungan selalu menyertai perjalanan politiknya mimamiqu gp 4presiden,RendiGemilangg,Capres,Fri Dec 15 10:35:55 +0000 2023,Ganjar Pranowo Exemplary Leadership rooted the value of family support always accompanying his political journey Mimamiqu GP 4Presiden
1244,ganjar pranowo pemimpin selalu mendekatkan diri masyarakat mendengarkan aspirasi bertindak sesuai kebutuhan ellabelli54731 gp 4presiden,adisudarmoo,Capres,Fri Dec 15 10:35:55 +0000 2023,Ganjar Pranowo The leader always draws closer to the community listening to the aspirations of acting according to Ellabelli54731 GP 4PRESIDA
1245,semua orang punya masa lalu yang terpenting bagaimana seseorang tumbuh berkembang pak ganjar membuktikan komitmennya rakyat jakarta lakmvnta1 gp 4presiden,l1tatanummm,Capres,Fri Dec 15 10:35:54 +0000 2023,Everyone has the most important past how a person grows developing Mr. Ganjar proves his commitment to the people of Jakarta Lakmvnta1 GP 4Presiden
1246,mahfud md pasangan ganjar pranowo memberikan harapan baru kestabilan politik sosial yiii 21 gp 4presiden,marisaclaris5,Capres,Fri Dec 15 10:35:53 +0000 2023,Mahfud MD Ganjar Pranowo pair gave new hopes for the Social Political Stability
1247,kemesraan keluarga ganjar pranowo cerminan seorang pemimpin mampu menghadirkan kehangatan setiap kebijakannya zhappire gp 4presiden,maysharharkalin,Capres,Fri Dec 15 10:35:53 +0000 2023,Ganjar Pranowo's family intimacy is a reflection of a leader able to bring the warmth of every policy of Zhapire GP 4Presiden
1248,kedewasaan kebijaksanaan pak ganjar mengelola keluarga cermin kepemimpinan solid suuuppp gp 4presiden,RizkFitrah,Capres,Fri Dec 15 10:35:53 +0000 2023,Maturity of Pak Ganjar's wisdom managing the Mirror Family of the Solid Suuuppp GP 4Presiden
1249,seinginga jatim semakin maju mas ganjar pranowo presiden pak mahfud md wakil presiden sudah terbukti mengelola keluarga baik hisayuside gp 4presiden,FahmiAdriian,Capres,Fri Dec 15 10:35:52 +0000 2023,Seinginga East Java is increasingly advanced mas Ganjar Pranowo President Pak Mahfud MD Vice President has been proven to manage the family both Hisayuside GP 4Presiden
1250,jakarta yakin ganjar pranowo membawa sentuhan keberagaman keadilan bersama mahfud md melangkah menuju perubahan diinginkan laahhyut gp 4presiden,zivamagloya,Capres,Fri Dec 15 10:35:52 +0000 2023,Jakarta Confident Ganjar Pranowo brought a touch of diversity of justice with Mahfud MD stepping towards the desired change of Laahhyut GP 4Presiden
1251,seinginga kehangatan keluarga pak ganjar menjadi inspirasi kita semua sukses perjuangan beliau bersama pak mahfud md rpikatsenyummu gp 4presiden,ZainNaher56,Capres,Fri Dec 15 10:35:51 +0000 2023,"The warmth of the family of Mr. Ganjar is an inspiration for all of our successful struggles with Mr. Mahfud MD, RPIKISImamu GP 4Presiden"
1252,kesederhanaan mas ganjar keluarganya menciptakan gambaran kekuasaan harus diiringi kemewahan berlebihan ian56973162436 gp 4presiden,isanfikrii37252,Capres,Fri Dec 15 10:35:50 +0000 2023,The simplicity of Mas Ganjar his family created a picture of power must be accompanied by excessive luxury Ian56973162436 GP 4Presiden
1253,bapak mahfud md diharapkan membawa pengalaman pengetahuan luas mendukung kepemimpinan mas ganjar weetyxmee gp 4presiden,mulydnauf,Capres,Fri Dec 15 10:35:50 +0000 2023,Mr. Mahfud MD is expected to bring extensive knowledge of supporting the leadership of Mas Ganjar Weetyxmee GP 4PRESIDEND
1254,sukses terus mas ganjar pranowo pak mahfud md seinginga kepemimpinan membawa keberkahan kemakmuran rakyat indonesia engkre8 gp 4presiden,ArifinBahrri,Capres,Fri Dec 15 10:35:49 +0000 2023,Success continues Mas Ganjar Pranowo Pak Mahfud MD Seinginga leadership brings the blessing of the prosperity of the Indonesian people crank.
1255,keberpihakan mas ganjar alam menjadi alasan tambahan mendukung kepemimpinannya kyzhiie gp 4presiden,NClaudya0907,Capres,Fri Dec 15 10:35:49 +0000 2023,Mas Ganjar Alam's partisanship is an additional reason to support his leadership Kyzhiie GP 4PRESIDEND
1256,ganjar pranowo seinginga teladan kebersamaan keluarga menjadi terang perjalanan kepemimpinan incirangin27 gp 4presiden,kusserini97,Capres,Fri Dec 15 10:35:48 +0000 2023,Ganjar Pranowo Seinginga Exemplary Family Togetherness Becomes a Bright Journey of Incirangin27 GP 4Presiden
1257,anjarpranowo lamganjar14 ulang tahunnya alam ganjar nih seinginga selalu diberi kebahagiaan kesuksesan setiap langkahnya,420rupiah,Capres,Fri Dec 15 10:35:47 +0000 2023,Anjarpranowo Lamganjar14 The birthday of Ganjar is always given the happiness of the success of every step
1258,mas ganjar pranowo pak mahfud md pasangan diharapkan membawa perubahan positif jatim indonesia dukungan untuk kalian oytayyo gp 4presiden,gilangrendiii,Capres,Fri Dec 15 10:35:46 +0000 2023,"Mas Ganjar Pranowo Pak Mahfud MD, the couple is expected to bring positive changes in East Java, support for you Oytayyo GP 4Presiden"
1259,seinginga kemesraan keluarga ganjar pranowo menular setiap lapisan masyarakat tbtww gp 4presiden,novadeviaaaa,Capres,Fri Dec 15 10:35:46 +0000 2023,Seinginga The intimacy of the Ganjar Pranowo family is transmitted to every level of society TBTWW GP 4PRESIDENID
1260,sifat ramah rendah hati ganjar pranowo menciptakan citra pemimpin dekat rakyat igtoys23 gp 4presiden,gnwnrkaaarkaa,Capres,Fri Dec 15 10:35:34 +0000 2023,Ganjar Pranowo's humble friendly nature created the image of a leader near the people of IGTOYS23 GP 4PRESIDENID
1261,kemesraan keluarga ganjar pranowo bukti nyata seorang pemimpin mampu menjaga keseimbangan pekerjaan keluarga yfqhrslnnn gp 4presiden,achamut34,Capres,Fri Dec 15 10:35:34 +0000 2023,Ganjar Pranowo's family intimacy Real proof of a leader is able to maintain the balance of the family work of the YFQHRSLNNN GP 4Presiden
1262,seinginga kebersamaan keluarga ganjar pranowo memberikan semangat positif memajukan jakarta depan idietaditya3 gp 4presiden,bagusputtr,Capres,Fri Dec 15 10:35:33 +0000 2023,Seinginga together with the family of Ganjar Pranowo's family gives a positive spirit to advance Jakarta in front of Idietaditya3 GP 4PRESIDENID
1263,ganjar pranowo pak mahfud md seinginga visi kebersamaan kepedulian rakyat membawa perubahan positif kita harapkan nhppiest gp 4presiden,LidyaLestri,Capres,Fri Dec 15 10:35:33 +0000 2023,Ganjar Pranowo Pak Mahfud MD Seinginga The vision of togetherness of the people's concern brings positive changes we expect NHPPIEST GP 4PRESIDENID
1264,mahfud md harapan agar kehadiran dapat menambahkan sentuhan kekeluargaan kepemimpinan ganjar pranowo ipaasaangin gp 4presiden,trnutyantiiiiii,Capres,Fri Dec 15 10:35:32 +0000 2023,Mahfud MD hopes that the presence can add a touch of kinship of Ganjar Pranowo Ipaasaangin GP 4PRESIDEND
1265,kepemimpinan mas ganjar pranowo contoh seorang pemimpin sejati yang mampu mengayomi keluarga rakyatnya ugar rainn gp 4presiden,HaruniWinddd,Capres,Fri Dec 15 10:35:31 +0000 2023,The leadership of Mas Ganjar Pranowo for example a true leader who is able to protect his people's families Ugar Rainn GP 4PRESIDENID
1266,keharinginnisan keluarga ganjar pranowo nilai tambah luar biasa seinginga nilai nilai terbawa kepemimpinannya kesejahteraan rakyat enjarzn gp 4presiden,wativinaaaaa,Capres,Fri Dec 15 10:35:31 +0000 2023,Ganjar Pranowo Family Pranowo's Extraordinary Value Value The value of his leadership is the welfare of the people of Enjarzn GP 4Presiden
1267,ganjar pranowo membuktikan kebahagiaan keluarga kunci membawa kebahagiaan masyarakat abaryages gp 4presiden,diniafini_,Capres,Fri Dec 15 10:35:27 +0000 2023,Ganjar Pranowo proves the happiness of the key family bringing the happiness of the ABARYAGES GP 4PRESIDENID community
1268,mas ganjar pranowo pak mahfud md pasangan diharapkan menghadirkan perubahan positif keadilan seluruh masyarakat jatim sukses kalian opokkipedas gp 4presiden,fikrihlmwn,Capres,Fri Dec 15 10:35:25 +0000 2023,"Mas Ganjar Pranowo Pak Mahfud MD, the couple is expected to bring positive changes in justice of the entire East Java community."
1269,kemesraan ganjar pranowo keluarga menunjukkan pemimpin sejati hanya panggung politik juga rumah heunseeninginm gp 4presiden,melindaputri_7,Capres,Fri Dec 15 10:35:25 +0000 2023,Ganjar Pranowo Keluarga's intimacy shows the true leader only the political stage as well as the house of Heunseeninginm GP 4Presiden
1270,ganjar pranowo representasi pemimpin mengerti rasa rakyat bersama mahfud md indonesia lebih dekat keadilan lackchiga91287 gp 4presiden,agam_arian,Capres,Fri Dec 15 10:35:24 +0000 2023,Ganjar Pranowo Representation of Leaders Understanding the people's taste with Mahfud MD Indonesia Closer
1271,dukungan mas ganjar pranowo pak mahfud md seinginga membawa terobosan positif untuk jakarta botx11 gp 4presiden,syifahani_,Capres,Fri Dec 15 10:35:24 +0000 2023,Support Mas Ganjar Pranowo Pak Mahfud MD Seinginga brought a positive breakthrough to Jakarta Botx11 GP 4PRESIDEND
1272,atikoh istri pak ganjar contoh di balik kesuksesan seorang pria peran besar seorang wanita syrofi gp 4presiden,bsmanbill,Capres,Fri Dec 15 10:35:23 +0000 2023,Atikoh Pak Ganjar's wife Example behind the success of a man the big role of a woman Syrofi GP 4Presiden
1273,melihat video kemesraan keluarga ganjar pranowo membuat yakin jakarta dipimpin pemimpin mencintai anak bangsanya lan farizy gp 4presiden,restuanggaraa,Capres,Fri Dec 15 10:35:22 +0000 2023,Seeing the video of the intimacy of the Ganjar Pranowo family made sure that Jakarta was led by the leader to love his nation's son Lan Farzy GP 4Presiden
1274,keberhasilan mas ganjar mendidik anak anaknya menjadi bukti beliau memiliki kapasitas membimbing memimpin bijaksana inanoviantii gp 4presiden,HaqimRizki40,Capres,Fri Dec 15 10:35:19 +0000 2023,The success of Mas Ganjar to educate his children is proof that he has the capacity to guide the wise lead Inanoviantii GP 4Presiden
1275,video kemesraan keluarga mas ganjar memberikan harapan di tangan indonesia menjadi tempat lebih hangat berdaya haaa aja gp 4presiden,WiraEthan75616,Capres,Fri Dec 15 10:35:19 +0000 2023,Video of the intimacy of the family of Mas Ganjar gave hope in the hands of Indonesia to be a warmer place empowered haaa
1276,ganjar pranowo contoh pemimpin memiliki kecerdasan einginsional kebijaksanaan memimpin keluarga negara lianajuli67785 gp 4presiden,jelilakynaaa,Capres,Fri Dec 15 10:40:33 +0000 2023,Ganjar Pranowo Examples of leaders have intelligence in the policy of leading the Lianajuli Family Family67785 GP 4Presiden
1277,eddysitorus yang disampaikan bung burhandin survey dilakukan bulan juli september 18 provinsi saat hampir semua survey ganjar menang,AgusFHermawan1,Capres,Fri Dec 15 10:40:33 +0000 2023,Edi Sitorus delivered by Bung Burhanudin Survey was conducted in July September 18 Province when almost all Ganjar surveys won
1278,ganjar pranowo kehangatan keluarga menjadi cermin kepemimpinan ramah dekat rakyat isseokjinkim gp 4presiden,milayudhiaa,Capres,Fri Dec 15 10:40:32 +0000 2023,Ganjar Pranowo The warmth of the family became a mirror of a friendly leadership near the people of Isseokjinkim GP 4Presiden
1279,keakraban kepedulian mas ganjar pranowo keluarganya cerminan kepemimpinan tidak bertanggung jawab pekerjaan juga kehidupan pribadi akeitslowhoney gp 4presiden,akbarrbary,Capres,Fri Dec 15 10:40:32 +0000 2023,"The familiarity of the concern of Mas Ganjar Pranowo, his family, is a reflection of irresponsible leadership as well as the personal life of Akeitslowhoney GP 4Presiden"
1280,keakraban keluarga ganjar cermin kepemimpinan inklusif peduli kepentingan masyarakat aldaasn gp 4presiden,RezaHarkiix,Capres,Fri Dec 15 10:40:31 +0000 2023,Family familiarity Ganjar Mirror Inclusive Leadership Cares for the interests of the Aldaasn GP 4PRESIDENDA community
1281,dukungan batas mas ganjar pranowo pak mahfud md adalah harapan baru jatim lebih baik apilautbetinaa gp 4presiden,CitraCyntia,Capres,Fri Dec 15 10:40:30 +0000 2023,Border support Mas Ganjar Pranowo Pak Mahfud MD is the new hope of East Java better Apilautbetinaa GP 4PRESIDENID
1282,dukungan untuk mas ganjar pranowo pak mahfud md seinginga visi misi menciptakan dampak positif besar llvvvvyyy gp 4presiden,IchsanChaidir12,Capres,Fri Dec 15 10:40:29 +0000 2023,Support for Mas Ganjar Pranowo Pak Mahfud MD Seinginga Visi Misi Creating a Big Positive Impact of LLVVVVYYY GP 4PRESIDENID
1283,pemimpin peduli keluarganya akan peduli kesejahteraan rakyatnya yang lihat mas ganjar pranowo idiarariyudo gp 4presiden,nadiaftrr1,Capres,Fri Dec 15 10:40:29 +0000 2023,The leader cares for his family will care about the welfare of his people who see Mas Ganjar Pranowo Idiariariyudo GP 4Presiden
1284,ngakak sama fanboy ganjar satu kenapa si klean hobi upload yang lewat pollingnya juli september sekalian survey awal2 tahun aja pas ganjar no 1 kebanyakan polster lokal,Tuman6032276076,Capres,Fri Dec 15 10:40:29 +0000 2023,not with fanboy ganjar one why the klean hobby uploaded through his poll in July in September all the surveys at the beginning
1285,mahfud md seinginga sinergi ganjar pranowo melahirkan kepemimpinan adil berkeadilan ukapisangk gp 4presiden,AmaliaGriz5,Capres,Fri Dec 15 10:40:29 +0000 2023,Mahfud MD Seinginga Sinergi Ganjar Pranowo gave birth to a fair leadership of equitable gp 4presiden
1286,ganjar pranowo mahfud md kehangatan keluarga kalian pencerminan kehangatan diharapkan setiap sudut jakarta aisylittle04 gp 4presiden,SafitSafitriani,Capres,Fri Dec 15 10:40:29 +0000 2023,Ganjar Pranowo Mahfud Md The warmth of your family reflects the warmth is expected to every corner of Jakarta Aisylittle04 GP 4PRESIDENID
1287,mahfud md ciamis janjikan program insentif guru madrasah marbot masjid pasangan capres cawapres ganjar mahfud md mengklaim bakal memprioritaskan program pemberian insentif kesejahteraan guru madrasah marbot m,harapanrakyat_,Capres,Fri Dec 15 10:40:28 +0000 2023,Mahfud MD Ciamis promised the Madrasah Madrasah Teacher Mosque incentive program Mosque of the Vice Presidential Candidate Ganjar Mahfud MD claimed to prioritize the program of giving incentives for the welfare of Madrasah Madrasah MARBOT M teacher.
1288,kebersamaan ganjar pranowo keluarganya fondasi utama dapat membawa keharinginnisan dalam kepemimpinan negara uhapayahm gp 4presiden,drrlvccoo,Capres,Fri Dec 15 10:40:27 +0000 2023,"Togetherness of Ganjar Pranowo, his family, the main foundation can bring the desires in the leadership of the state of UHAPAYAHM GP 4PRESIDENID"
1289,kemesraan keluarga ganjar cerminan nyata pemimpin baik yang memahami nilai nilai keluarga ippanijjang gp 4presiden,najimhmmd,Capres,Fri Dec 15 10:40:27 +0000 2023,Ganjar family intimacy is a real reflection of a good leader who understands the value of the IPPANIJJANG GP Family Value 4Presiden
1290,etikcom ganjar pranowo mencerminkan sikap progresif menangani isu isu pertanian khususnya terkait pupuk,afganharun36610,Capres,Fri Dec 15 10:40:27 +0000 2023,"Etikcom Ganjar Pranowo reflects the progressive attitude to deal with agricultural issues, especially related to fertilizer"
1291,kedekatan mas ganjar keluarganya menggambarkan keberhasilan seorang pemimpin dimulai kebahagiaan rumah tangganya erlanjur dalam gp 4presiden,putranawiiii,Capres,Fri Dec 15 10:40:26 +0000 2023,"The closeness of Mas Ganjar, his family, illustrates the success of a leader begins happiness in his household, Erlanjur in GP 4Presiden"
1292,video kemesraan ganjar pranowo menjadi pesan kebijaksanaan keluarga merembes kebijaksanaan dalam pemerintahan akiuki gp 4presiden,tiaraiffah21,Capres,Fri Dec 15 10:40:26 +0000 2023,Video of Ganjar Pranowo's intimacy became the message of family wisdom to seep wisdom in the Akuki GP 4Presiden government
1293,sukses selalu mas ganjar pranowo seinginga kehangatan keluarganya membawa semangat positif seluruh masyarakat jatim anti1873 gp 4presiden,MaryaaamSiti,Capres,Fri Dec 15 10:40:26 +0000 2023,Success is always Mas Ganjar Pranowo Seinginga The warmth of his family brings positive enthusiasm for the entire Jatim Anti 1873 GP 4Presiden community
1294,ganjar pranowo atikoh membangun fondasi keluarga sehat menjadi ingindal kuat kepemimpinan sukses eeane412 gp 4presiden,yusfi_randi,Capres,Fri Dec 15 10:40:13 +0000 2023,Ganjar Pranowo Atikoh built a healthy family foundation into a strong leadership of the success of the EANE412 GP 4PRESIDENID
1295,ganjar pranowo mahfud md berharap kalian membawa jakarta menuju masa depan lebih cerah andan danis gp 4presiden,AisyahAzizah_1,Capres,Fri Dec 15 10:40:13 +0000 2023,Ganjar Pranowo Mahfud MD hopes that you bring Jakarta to the brighter future Andan Danis GP 4Presiden
1296,keluarga haringinnis aset berharga mas ganjar membuktikan dia menjaga keharinginnisan segala ianschaos gp 4presiden,maharanikrnti,Capres,Fri Dec 15 10:42:06 +0000 2023,Haringinnis family valuable assets Mas Ganjar proves he maintains the desires of all Ianschaos GP 4PRESIDENID
1297,bersama keluarga haringinnis mas ganjar membuktikan kepemimpinan dimulai rumah seinginga terus menjadi teladan kita semua imunsedih gp 4presiden,KVisi19425,Capres,Fri Dec 15 10:42:05 +0000 2023,Together with the Haringinnis family Mas Ganjar proved that the leadership began to be the same as our example of all of us immunsedih GP 4PRESIDAVE
1298,keakraban ganjar pranowo keluarganya menunjukkan dia pemimpin tidak berbicara juga bertindak nyata kkazh gp 4presiden,MaulAkbarr3,Capres,Fri Dec 15 10:42:04 +0000 2023,"The familiarity of Ganjar Pranowo, his family, shows that he is the leader not to speak, he also acts real"
1299,ganjar mahfud membawa angin segar politik jakarta membawa nilai nilai keluarga positif wkward anna1 gp 4presiden,aprizaric,Capres,Fri Dec 15 10:42:02 +0000 2023,Ganjar Mahfud brought a fresh political air of Jakarta to bring the value of positive family wkward Anna1 GP 4PRESIDEND
1300,mas ganjar pranowo pak mahfud md contoh nyata kepemimpinan baik hasil nilai nilai keluarga solid udi saputra199 gp 4presiden,indahprnmsri100,Capres,Fri Dec 15 10:42:02 +0000 2023,Mas Ganjar Pranowo Pak Mahfud MD Real Examples of Leadership Both Results of the Value Value of Solid Udi Saputra199 GP 4Presiden
1301,okingoding thadisaputra tugase ganjar yo melayani rakyat jateng lah daerah liane yo entuk layanan lah mbok kiro semarang tok wae gawean e ganjar gubernur mu kui sing luwih aneh,Paskalises17,Capres,Fri Dec 15 10:42:02 +0000 2023,"Okingoding Thadisaputra Taskane Ganjar Yo serves the people of Central Java, the Liane Yo area is formed, the service is Mbok Kiro Semarang, Tok Wae Gawean E Ganjar Governor MU Kui Sing Luwih Strange"
1302,kepemimpinan mas ganjar pranowo pak mahfud md jawaban atas kebutuhan masyarakat pemimpin dapat mempersatukan memberdayakan nidaa gp 4presiden,CantikaPutrixxz,Capres,Fri Dec 15 10:42:02 +0000 2023,Leadership of Mas Ganjar Pranowo Pak Mahfud MD Answers to the needs of the community leader can unite empowering Nidaa GP 4PRESIDENID
