,full_text,username,Kategori,created_at,tweet_english
565,igifeeder rabowo ibran tweet erindra lextham878 engkeldodo entangnegeri quitavee amlogan95 ojeoz aden wijaya008 sosok capres geinginy memberikan riang gembira masyarakat,Ratu_0509,Capres,Fri Dec 15 04:09:35 +0000 2023,Igifeeder Rabowo Ibran Tweet Erindra Lextham878 Engkeldodo Entangnegeri Quitavee Amlogan95 Ojeoz Aden Wijaya008 The figure of the Candidate Geiny gave cheerful people
566,duh hobi ko julurin lidah si pak kalau calon pemimpin hobi julurin tangan bantu anak bangsa gacoan anies daesang olivia gempa adidas dana ahok batter up 100m views inginlly ginting pilihan terbaik kela prabowo,DiajengDinanti,Capres,Fri Dec 15 04:09:34 +0000 2023,duh hobby ko julurin the tongue sir if the prospective leader hobby julurin helps the children of the nation gacoan anies daesang olivia earthquake adidas dana ahok batter up 100m views want tolly ginting the best choice of prabowo
567,haves1305 prabowo gak usah ikutan debat lah ikutan cerdas cermat aja,Mohjamal27,Capres,Fri Dec 15 04:09:34 +0000 2023,"Haves1305 Prabowo don't need to follow the debate, just follow the smartness"
568,ahy minta kader panaskan mesin partai menangkan prabowo pilpres 2024 odd pdeinginkrat agusyudhoyono deinginkrat bareng ahy,Iza_Zot,Capres,Fri Dec 15 04:09:30 +0000 2023,AHY asked the party cadre to heat the party to win Prabowo Prabowo 2024 PDEINTRABRAT PDEINTHRAGE AGUSYUDHOYONO DEEINKRAT with AHY
569,kalau mah bukan bagi bansos namanya pak kampanye disponsori negera gacoan anies daesang olivia gempa adidas dana ahok batter up 100m views inginlly ginting pilihan terbaik kela prabowo,MacanAsiaGagal,Capres,Fri Dec 15 04:09:29 +0000 2023,"If it's not for social assistance, the name is pak sponsored by Gacoan State Anies Daesang Olivia Earthquake Adidas Dana Ahok Batter Up 100m Views Want to Ginted the best choice of Prabowo"
570,vonenews heuheu nyerang prabowo pake kata oposisi 2partai koalisi di pemerintahan oposisi ndasmu broo,bolink24,Capres,Fri Dec 15 04:09:28 +0000 2023,TVOneNews heuheu attacked Prabowo using the word opposition of the coalition party in the government of the opposition ndasmu brooo
571,ahy instruksikan kader deinginkrat menangkan prabowo pilpres 2024 ij pdeinginkrat agusyudhoyono deinginkrat bareng ahy,Iza_Zot,Capres,Fri Dec 15 04:09:27 +0000 2023,AHY Instructing Cadre Deepinkrat Winning Prabowo Presidential Election 2024 IJ PDEINTING AGUSYUDHOYONO DEEINT
572,ndre rosiade emang capres goblok prabowo tinggal jawab aja mau nyelesaikan apa engga intangaryagun2 menolak lupa,akbarhLandi,Capres,Fri Dec 15 04:09:27 +0000 2023,"Andre Rosiade is indeed a Goblok Prabowo presidential candidate, just answer to what I want to complete, not, Intangaryagun2 refused to forget"
573,ahy instruksikan kader deinginkrat rapatkan barisan menangkan prabowo rel agusyudhoyono pdeinginkrat deinginkrat bareng ahy,Iza_Zot,Capres,Fri Dec 15 04:09:25 +0000 2023,AHY instructed the cadre deintikrat to close the ranks to win Prabowo Rail Agusyudhoyono PDEINTAKRAT DEEINKRAT with AHY
574,dlm debat anies n ganjar spt kompak serang prabowo ttg pelanggaran ham bisnis macet ga ikut kekuasaan knp prabowo ga balik nanya kasus e ktp ganjar ato formula e warga dki meninggal tp trlantar anies jubir n bala 02 lbh sibuk counter serangan lawan settingan gasi,kanitanafiza,Capres,Fri Dec 15 04:09:24 +0000 2023,"In the debate Anies n Ganjar like a compact attack Prabowo about human rights violations of the business of traffic jams, not to have the power of KNP Prabowo, not asking for the case of E Ganjar at the formula e DKI citizens died but the trlanty Anies jubir n reinforcement"
575,ahy ajak seluruh kader partai deinginkrat menangkan prabowo pilpres 2024 upj pdeinginkrat agusyudhoyono deinginkrat bareng ahy,Iza_Zot,Capres,Fri Dec 15 04:09:22 +0000 2023,AHY invites all deinkrat Party cadres to win Prabowo Presidential Election 2024 UPJ PDEINTHKRAT AGUSYUDHOYONO DEEINTKRAT with AHY
576,bansos merupakan bagian peran negara hadir masyarakat miskin bukan ajang bancakan sosial kampanye gacoan anies daesang olivia gempa adidas dana ahok batter up 100m views inginlly ginting pilihan terbaik kela prabowo,BerandalanHam,Capres,Fri Dec 15 04:09:22 +0000 2023,"Bansos is a part of the role of the state present the poor, not a social event for the gacoan campaign Anies Daesang Olivia, the Adidas Dana Ahok Batter up earthquake 100m views want tolly ginting the best choice of Prabowo"
577,persatuan prabowo jokowi tahun 2019 membuat indonesia melewati berbagai krisis beberapa tahun terakhir dekade08,bungaindisari,Capres,Fri Dec 15 04:09:21 +0000 2023,The 2019 Prabowo Jokowi Association made Indonesia pass various crises in recent years Decade08
578,jel0up rabowo netizen kepo bukan krn siapa paling banyak hartanya cangkem prabowo blunder panggung debat gak punya apa apa padahal dg 2t tersebut apa apa punya,bangoneeee,Capres,Fri Dec 15 04:09:21 +0000 2023,Jel0 Prabowo Netizen Kepo is not because who has the most treasures Prabowo bladers in the debate stage don't have anything even though the 2T is what do you have
579,pakai strategi serangan darat udara deinginkrat jakarta kerja keras menangkan prabowo t agusyudhoyono pdeinginkrat deinginkrat bareng ahy,Iza_Zot,Capres,Fri Dec 15 04:09:20 +0000 2023,Use the DEINKKRAT Jakarta Air Attack Strategy to Work Hard Winning Prabowo T Agusyudhoyono PDEINT
580,haves1305 niesbaswedan ahrihamzah erindra atuakrajoangek wakwawaww inginhon maaf numpang tanya kali pak prabowo mau nyalonin jadi presiden apa mau nyalonin jadi mentri pak kasihan bapak udah capek maki orang fitnah orang gak taunya di bela sebenernya cuma mau jadi mentri,MesaAlfarizi,Capres,Fri Dec 15 04:09:18 +0000 2023,"Haves1305 Niesbaswedan Ahrihamzah Erindra Atuakrajoangek Wakwawwwwaww Want to Sorry to Ask Pak Prabowo Want to Nyalonin to be President or if you want to turn out to be the Minister of Pharmacy, Mr."
581,angsemproel ivacoid lambe turah mintain pendapat aja dah aneh doi sebarisan ama si ituh,JHPrabowo,Capres,Fri Dec 15 04:09:17 +0000 2023,Angsemproel Ivacoid Lambe Turah just ask for an opinion and it's weird.
582,bansos buat rakyat miskin bukan kebutuhan kampanye gacoan anies daesang olivia gempa adidas dana ahok batter up 100m views inginlly ginting pilihan terbaik kela prabowo,NyapresAbadi,Capres,Fri Dec 15 04:09:17 +0000 2023,social assistance for the poor is not the need for the gacoan campaign Anies Daesang Olivia Earthquake Adidas Dana Ahok Batter Up 100m Views Want to Ginting Ginting the best choice of Prabowo
583,erindra rabowo jogetin aja wkwkkkkk,DwiSupr10672222,Capres,Fri Dec 15 04:09:16 +0000 2023,Erindra Rabowo just dancingin wkwkkkkk
584,deinginkrat sumbar tegak lurus instruksi ahy siap menangkan prabowo pilpres 2024 kyz agusyudhoyono pdeinginkrat deinginkrat bareng ahy,Iza_Zot,Capres,Fri Dec 15 04:09:15 +0000 2023,DEEINKRAT SUMBAR is perpendicular
585,ahy ngaku tak masalah siapapun cawapres prabowo fokus kemenangan nyang agusyudhoyono pdeinginkrat deinginkrat bareng ahy,Iza_Zot,Capres,Fri Dec 15 04:09:13 +0000 2023,AHY admitted that no problem anyone Prabowo vice president focused on the victory of Nyang Agusyudhoyono PDEINTHKRAT with AHY
586,semangat pembaharuan prabowo gibran rintisan keemasan negeri 17program prioritaspragibs,IndahAniwati,Capres,Fri Dec 15 04:09:12 +0000 2023,The spirit of renewal of Prabowo Gibran State Golden Solden Pioneering 17 Priority Programs
587,kalau mah bukan bagi bansos namanya pak kampanye disponsori negera gacoan anies daesang olivia gempa adidas dana ahok batter up 100m views inginlly ginting pilihan terbaik kela prabowo,AgustinaPrdpta,Capres,Fri Dec 15 04:09:11 +0000 2023,"If it's not for social assistance, the name is pak sponsored by Gacoan State Anies Daesang Olivia Earthquake Adidas Dana Ahok Batter Up 100m Views Want to Ginted the best choice of Prabowo"
588,titip agenda prabowo ahy esensi perubahan perbaikan kita perjuangkan rga pdeinginkrat agusyudhoyono deinginkrat bareng ahy,Iza_Zot,Capres,Fri Dec 15 04:09:10 +0000 2023,entrust the agenda of Prabowo AHY the essence of our changes in the improvement of PDEINTAKRAT AGUSYUDHOYONO DEEINKRAT with AHY
589,anies ganjar ga tegas gatau mau lanjutin apa udah deh jelas jelas aja pak prabowo,andrespra___,Capres,Fri Dec 15 04:09:09 +0000 2023,"Anies Ganjar isn't firm, I don't want to continue, it's clear, Prabowo"
590,atakujiyati biar adil anis cocok jadi presiden debat biarlah prabowo jadi presiden indonesia,fais21804461,Capres,Fri Dec 15 04:09:09 +0000 2023,"tatak testiyati so that Adil Anies is suitable to be president of the debate, let Prabowo be president of Indonesia"
591,masing masing buzzer pendukungnya niesbaswedan rabowo anjarpranowo kan yakin tuh kalo dipegangnya bakal menang jadi presiden kenapa saling menjelekan satu sama,bboy_athrrnrdr,Capres,Fri Dec 15 04:09:09 +0000 2023,"Each supporter support Anies Baswedan Prabowo Anjar Pranowo is sure that if he is holding it, he will win to be president, why do one of the same one"
592,avan eka avidnurbianto mnurut gw sih gara2 bangpior deh kalau gak salah disalah satu konten mengatakan memilih prabowo geinginy blang pas melihat potongan tt pak ps mbak najwa eits entar tunggu dulu sambil joget soalnya ptongan tt bangpior rame,KulaEmon,Capres,Fri Dec 15 04:09:08 +0000 2023,"Avan Eka Avidnurbianto according to me because of Bangpior, if I'm not mistaken in one of the content saying choosing Prabowo Geiny Blang when I saw the TT Pak PS Mbak Najwa Eits."
593,artaisocmed pak prabowo ditemani cawapres walikota solo min,_toriqq,Capres,Fri Dec 15 04:09:07 +0000 2023,Artaisocmed Pak Prabowo accompanied by Vice President of the Mayor of Solo Min
594,ahy minta kader panaskan mesin partai menangkan prabowo pilpres 2024 jla agusyudhoyono pdeinginkrat deinginkrat bareng ahy,Iza_Zot,Capres,Fri Dec 15 04:09:07 +0000 2023,AHY asked the party cadre to heat the party to win the 2024 presidential election JLA Agusyudhoyono PDEINTHKRAT with AHY
595,prabowo tegaskan tambah gaji hapus pungli,jurnascom,Capres,Fri Dec 15 04:09:04 +0000 2023,Prabowo emphasizes added salary to delete extortion
596,komitmen dukung prabowo ahy pastikan hadiri pertemuan ketum kim nun agusyudhoyono pdeinginkrat deinginkrat bareng ahy,Iza_Zot,Capres,Fri Dec 15 04:09:02 +0000 2023,Commitment to Support Prabowo AHY Ensure to attend the Kim Nun Agusyudhoyono meeting
597,igifeeder rabowo ibran tweet erindra lextham878 engkeldodo entangnegeri quitavee amlogan95 ojeoz aden wijaya008 genit banget pak prabowo didalam video klip nya,nandiny44,Capres,Fri Dec 15 04:09:01 +0000 2023,Igifeeder Rabowo Ibran Tweet Erindra Lextham878 EntangNegeri QUITAGERI AMLOGAN95 OJEOZ ADEN WIJAYA008 PAK PRABOWO is very flushed in his video clip
598,oleesheetz artaisocmed rabowo buka mata lu cong cek tuh akun ngangngengngong ngak jls lu,Kuramaisme,Capres,Fri Dec 15 04:08:59 +0000 2023,Oleesheetz Artaisocmed Rabowo Opens your eyes Cong check the account ngangngngngong ngak jls you
599,elektabilitas kian meningkat ahy optimis prabowo gibran menang pilpres 2024 w v agusyudhoyono pdeinginkrat deinginkrat bareng ahy,Iza_Zot,Capres,Fri Dec 15 04:08:57 +0000 2023,Electability is increasing AHY Optimistic Prabowo Gibran won the Presidential Election 2024 W V Agusyudhoyono PDEINTING DEEINKRAT with AHY
600,fyp full kampanye prabowo gini ckck,akbalal,Capres,Fri Dec 15 04:08:57 +0000 2023,Fyp Full Prabowo Campaign Gini Ckck
601,depan taruna akmil prabowo ingatkan pengabdian pengorbanan prajurit tni bersifat selamanya dekade08,KhansaAruna4,Capres,Fri Dec 15 04:08:56 +0000 2023,in front of the Akmil Taruna Prabowo remind the sacrifice of the TNI soldiers to be forever decade08
602,ahy prabowo gibran menang deinginkrat masuk ke pemerintahan ayd pdeinginkrat agusyudhoyono deinginkrat bareng ahy,Iza_Zot,Capres,Fri Dec 15 04:08:55 +0000 2023,AHY Prabowo Gibran won Deinternkrat into the Ayd Pdeinginkrat Agusyudhoyono government with AHY
603,zulhas optimistis prabowo gibran menang satu putaran seusai debat capres berdasarkan trend elektabilitas memang mendekati 50 masbowogibran gakretorika pakbowoikut maunyakita menang 1 putaran via eritasatu,KhoirilAnwar_,Capres,Fri Dec 15 04:08:52 +0000 2023,Zulhas is optimistic that Prabowo Gibran wins one round after the presidential debate based on the electability trend indeed approaches 50 Masbowogibran Gakretorika Pakbowoikir Maunyakita won 1 round via Eritasatu
604,hasil survei prabowo gibran inginncer ahy yakin menang putaran pertama hva pdeinginkrat agusyudhoyono deinginkrat bareng ahy,Iza_Zot,Capres,Fri Dec 15 04:08:50 +0000 2023,Prabowo Gibran's survey results want to be sure to win the first round of HVA PDEINTAGRY AGUSYUDHOYONO DEEINTKRAT with AHY
605,sby pak prabowo tak sendirian deinginkrat terus bersama lwn agusyudhoyono pdeinginkrat deinginkrat bareng ahy,Iza_Zot,Capres,Fri Dec 15 04:08:48 +0000 2023,"SBY Pak Prabowo is not alone, Deepingkrat continues with LWN Agusyudhoyono PDEINTHKRAT with AHY"
606,uliaaanidiya menhan prabowo kehidupan prajurit tentang pengabdian pengorbanan selamanya dekade08,halmanurgita72,Capres,Fri Dec 15 04:08:42 +0000 2023,Uliaaidiya Minister of Defense Prabowo the lives of soldiers about the service of sacrifice forever decade08
607,igifeeder solo bisa diubah waktu singkat yakin indonesia mampu ubahkan 1 periode bersama prabowo gibran,Ratu_0509,Capres,Fri Dec 15 04:08:41 +0000 2023,"Igifeeder Solo can be changed in a short time, sure Indonesia is able to Ubat 1 period with Prabowo Gibran"
608,emang kalo anjarpranowo jd president mau diapain rabowo berani ga keluar dlm debat isue berantas ham,lucky_hafner,Capres,Fri Dec 15 04:08:41 +0000 2023,"indeed, if Ganjar Pranowo is the president, what do you want to do with Prabowo not out of the issue debate eradication of human rights"
609,ngeri kali narasi pendukung prabowo bengis sekali kata2 nya apa mencerminkan di dukung,AghaAyah,Capres,Fri Dec 15 04:08:41 +0000 2023,"horrified by the narrative of supporters of Prabowo, very cruel words what reflects supported"
610,ibran tweet ersisofficial hayangkara fc deinginkrasi gak cuma soal menang pemilu fair transparan bro prabowo gibran lebih diuntungkan lho,RatuSita18876,Capres,Fri Dec 15 04:08:40 +0000 2023,Ibran Tweet Ersisofficial Hayangkara FC DeininKration is not just a matter of winning the transparent fair election bro Prabowo Gibran is more benefited you know
611,orosprabowo pak prabowo pecat nih adminnya koq malah proinginsiin pak anies awokawkok,jekseparoe,Capres,Fri Dec 15 04:08:37 +0000 2023,"Orosprabowo Pak Prabowo fired, the admin is even proinuing Mr. Anies Awokawkok"
612,uliaaanidiya prabowo gibran punya trik khusus pemilih masih bimbang dekade08,linda_oktaaviia,Capres,Fri Dec 15 04:08:36 +0000 2023,ULIAAANIDIYA Prabowo Gibran has a special trick for voters to be hesitant
613,ayo kt undang rabowo iranto1947 amp pemandu soraknya utk ikut hadir menemui keluarga korban,gmupd1993,Capres,Fri Dec 15 04:08:35 +0000 2023,"Come on, I invite Rabowo Iranto1947 AMP, the siret for attending the victim's family"
614,5 tempat wisata keluarga bandung rekomendasi liburan akhir tahun seru bersama orang tersayang masdar anies prabowo bts is coming gacoan seventeen gempa adidas,someone_sev,Capres,Fri Dec 15 04:08:35 +0000 2023,5 Bandung Family Tourist Attractions Recommended Any -year -end holidays with loved ones Masdar Anies Prabowo BTS is coming gacoan seventeen earthquake adidas
615,uliaaanidiya paslon 02 prabowo gibran jangan galau pilih pasti dekade08,distiaalviapuji,Capres,Fri Dec 15 04:08:33 +0000 2023,Uliaaidiya Paslon 02 Prabowo Gibran Don't Be Confused Choose Definite Decade08
616,oundefire aggerdast artaisocmed lu liat belakang prabowo kan hitung aja berpa penguasa situ 3 suharto sby jokowi artinya prabowo estafet dri penguasa2 tsbt,PubgMGlobal4,Capres,Fri Dec 15 04:08:32 +0000 2023,Undefine Aggerdast Partaisocmed You see Prabowo and Calculate there is the ruler of Situ 3 Suharto SBY Jokowi means Prabowo is the relay of the ruler
617,arkosun tenang pak prabowo menang hati tapi maaf anies lah pemenangnya saat tenang ada 2029 silahkan melawan inkamben presiden anies,IbenBesar,Capres,Fri Dec 15 04:08:31 +0000 2023,Arkosun calm Pak Prabowo won his heart but sorry Anies was the winner when there was a calm 2029 please fight the incamben President Anies
618,elektabilitas tembus 45 persen ahy prabowo menang satu putaran ze agusyudhoyono pdeinginkrat deinginkrat bareng ahy,Iza_Zot,Capres,Fri Dec 15 04:08:29 +0000 2023,Electability Translucent 45 percent AHY Prabowo won one round of Ze Agusyudhoyono PDEINTHKRAT DEEINKRAT with AHY
619,ahy prabowo pemimpin pemersatu bangsa sp pdeinginkrat agusyudhoyono deinginkrat bareng ahy,Iza_Zot,Capres,Fri Dec 15 04:08:24 +0000 2023,AHY Prabowo Leader of Unifying the Nation of the SP PD EINTING AGUS YUDHOYONO DEEINKKRAT with AHY
620,ennyindrayana klu org dapilku pst akn aku pilih aneh banget partainya dukung prabowo gibran tp malah di serang mulu jagoan partainya,Arietakduts,Capres,Fri Dec 15 04:08:20 +0000 2023,"Ennyindrayana, if my electoral district, I chose the party, the party was very strange to support Prabowo Gibran but instead it was attacked"
621,ibran gen ibran tweet rabowo seinginga hati tulus bekerja warga solo menjadikan mas gibran wakil presiden bekerja rakyat indonesia,nandiny44,Capres,Fri Dec 15 04:08:20 +0000 2023,Ibran Gen Ibran Tweet Rabowo Seinginga Hati Tulus Working Solo residents make Mas Gibran Vice President Working of the Indonesian People
622,nnindonesia bukannya prabowo menyerang anies anies mengungkapkan fakta apa terjadi lapangan sebenarnya aneh sekali kalian udimandjatmiko,Herri32407314,Capres,Fri Dec 15 04:08:17 +0000 2023,NNIndonesia instead of Prabowo attacking Anies Anies revealed the facts of what happened the field was actually strange you udimandjatmiko
623,hbd bro hidory sehat sukses geinginy selalu min erindra pendukungmu pendukung pak rabowo ultah neh kasih ucapanlah min,dJokoTingkir99,Capres,Fri Dec 15 04:08:16 +0000 2023,hbd bro hidori healthy successful teeth are always min Gerindra supporting your supporters of Mr. Rabowo's birthday
624,penting ar negeri sering dipakai berguna banget masdar anies prabowo bts is coming gacoan seventeen gempa adidas,someone_sev,Capres,Fri Dec 15 04:08:16 +0000 2023,Important AR Negeri is often used very useful Masdar Anies Prabowo BTS is coming gacoan seventeen earthquake adidas
625,uliaaanidiya paslon 02 prabowo gibran target 28 7 pemilih bimbang pilpres 2024 dekade08,salshaaul_,Capres,Fri Dec 15 04:08:15 +0000 2023,Uliaaidiya Paslon 02 Prabowo Gibran Target 28 7 Voters Bimbprespres 2024 Decade08
626,jengcute16 baru jadi ordal prabowo langsung gila,MurdowoH020257,Capres,Fri Dec 15 04:08:11 +0000 2023,Jengcute16 just became Prabowo's order immediately crazy
627,enkinginnica ndre rosiade betul mbak inginnica itu memang perjanjian pilpres 2019 pak prabowo mau disalip gubernur jokowi pas menjabat pilpres 2014 udah usang tuch perjanjian,barurambat,Capres,Fri Dec 15 04:08:09 +0000 2023,"Enkinginnica Andre Rosiade is right, Ms. I want NICA to do the 2019 Presidential Election Agreement Pak Prabowo wants to be overtaken by the Governor of Jokowi when he served as the 2014 presidential election already out of the agreement"
628,nasionalisme keteguhan prabowo subianto melawan inferiority complex,kompasiana,Capres,Fri Dec 15 04:08:08 +0000 2023,Nationalism of Prabowo Subianto's determination against the Inferiority Complex
629,lama lama bosen lihat prabowo viralnya kok cuma joged geinginy nya doang sama kontroversi mk ga punya lain apa,awangprasetya,Capres,Fri Dec 15 04:08:06 +0000 2023,"For a long time bored seeing Prabowo viral, how come it's just jogged geintyy with the controversy of MK, no one has anything else"
630,ahy tegaskan deinginkrat siap kampanye bareng prabowo gibran yvx agusyudhoyono pdeinginkrat deinginkrat bareng ahy,Iza_Zot,Capres,Fri Dec 15 04:08:06 +0000 2023,AHY emphasizes Deepinkrat ready to campaign with Prabowo Gibran YVX Agusyudhoyono PDEINTING DEEINT
631,ryprasetyo85 07koteka 3 nakula anakkolong l lasan gusvalent65949 iduk17 ilitan nkri unromli eruanhl 1nt4ng k1r4r4 gerakan reforma agraria mesti dirasakan rakjat gosip adanya bagi izin lahan tambang sudah cabut sebanyak 2600 izin dibagi adil merakjat seinginga pak rabowo nantinya membagikanya adil merakjat pateeen merdeka,Partikellirs,Capres,Fri Dec 15 04:08:03 +0000 2023,Ryprasetyo85 07Koteka 3 Nakula AnakKolong L Lasan Gusvalent65949 Iduk17 Ilitan NKRI Unromli Eruanl 1NT4NG K1r4r4 Agrarian Reform Movement must be felt Rakjat Gossip The existence of mining land permits have pulled 2600
632,sby instruksikan kader deinginkrat menangkan prabowo gibran tfc agusyudhoyono pdeinginkrat deinginkrat bareng ahy,Iza_Zot,Capres,Fri Dec 15 04:08:01 +0000 2023,SBY Instructs Cadres Deinkrat Winning Prabowo Gibran TFC Agusyudhoyono PDEINT
633,ibran gen ibran tweet rabowo respect sm kinerja mas gibran selalu maksimal,saraisyaa,Capres,Fri Dec 15 04:07:58 +0000 2023,Ibran Gen Ibran Tweet Rabowo Respect Sm Performance Mas Gibran is always maximum
634,eraloebss ibran tweet rabowo olkar id erindra atuakrajoangek si id nggedabrus mimpi buruk iya contohnya solo seorang kader lebih senior disleding jago walkot baru 3 hari jadi kader sekarang ketagihan mau nyawapres,slowwae7,Capres,Fri Dec 15 04:07:58 +0000 2023,Eraloebss Ibran Tweet Rabowo Olkar ID Erindra Atuakrajoangek The ID is NGEDABRUS NEGINMER WRITE YES For example a solo a cadre is more senior dislleding champion Walkot for 3 days so cadres are now addicted to Nyawirres.
635,beda survey litbang kompas ganjar 38 prabowo 30 anies 25,narkosun,Capres,Fri Dec 15 04:07:56 +0000 2023,Different Research and Development Survey Kompas Ganjar 38 Prabowo 30 Anies 25
636,asbil lbs niesbaswedan kalo prabowo gagal lg ahy ditarik jd menteri arb sampeyan tetep nyaleg ga,FachSetiawan,Capres,Fri Dec 15 04:07:52 +0000 2023,Asbil LBS Anies Baswedan if Prabowo failed again AHY was withdrawn so Minister ARB sampeyan remained nyaleg
637,citra geinginy prabowo selama merupakan bagian ilusi realitas dibuat,Onong76,Capres,Fri Dec 15 04:07:51 +0000 2023,Citra Geiny Prabowo as long as it is part of the illusion of reality
638,bersama pak rabowo mas gusyudhoyono silaturahmi kyai ulama amp santri ponpes miftahul huda tasikmalaya hfn agusyudhoyono pdeinginkrat deinginkrat bareng ahy,Iza_Zot,Capres,Fri Dec 15 04:07:50 +0000 2023,Together with Pak Rabowo Mas Gusyudhoyono Silaturahmi Kyai Ulama Amp Santri Ponpes Miftahul Huda Tasikmalaya HFN Agusyudhoyono PDEINTING DEEINKRAT with AHY
639,prabowo seorang patriot siap mati negara,bumnbersatu,Capres,Fri Dec 15 04:07:48 +0000 2023,"Prabowo, a patriot ready to die"
640,ahy prabowo pemimpin memperhatikan rakyat kecil zxy pdeinginkrat agusyudhoyono deinginkrat bareng ahy,Iza_Zot,Capres,Fri Dec 15 04:07:48 +0000 2023,AHY Prabowo The leader pays attention to the small people of Zxy PDEINTAKRAT AGUSYUDHOYONO DEEINKKRAT with AHY
641,riemutyara kecerdasan pak anies bisa membuat melel lidah nya prabowo,Rudetiawanst,Capres,Fri Dec 15 04:07:46 +0000 2023,Rie Mutiara Intelligence Pak Anies can make his tongue prabowo
642,enkinginnica kalo g jadi penguasa susah bisnisnya g bebas nah kalo gini kan berbisnis mulia sekali pa prabowo,wildancox,Capres,Fri Dec 15 04:07:46 +0000 2023,"enkinginnica if it doesn't become a difficult ruler, the business is free, if it's like this, it is a very noble business"
643,re inismyname 9propaganda engkeldodo dons back dri 7i ndreassolusi poklela7 lorieliciouss imberley 2024 ank joee angsayangsujud gelar anies seabrek abrek bahkan kuliah ny sampe luar negri bahkan pernah jadi rektor universitas paramdina rontok tangan pendukung prabowo gk pernah sekolah sama sekali,anu318725175311,Capres,Fri Dec 15 04:07:46 +0000 2023,Re Inismyname 9 Propaganda Engkeldodo dons back from 7i ndreassolusi poklela7 lorieliciousi imberley 2024 Ank Joee Angsayangsuntik title Anies Seabrek Abrek and even Lecture to Overseas Country and even once the Rector of the University
644,elektabilitas prabowo gibran selalu unggul ahy jangan kita merasa menang sxh pdeinginkrat agusyudhoyono deinginkrat bareng ahy,Iza_Zot,Capres,Fri Dec 15 04:07:43 +0000 2023,"Prabowo Gibran's electability is always superior to AHY, don't feel we won SXH PDEINTAHKRAT AGUSYUDHOYONO DEEINKRAT with AHY"
645,tempat beli cromboloni viral gresik alamat harga varian lengkap anies prabowo bts is coming gacoan seventeen gempa adidas,someone_sev,Capres,Fri Dec 15 04:07:40 +0000 2023,where to buy Gromboloni Viral Gresik Address Price Complete variant Anies Prabowo BTS is coming gacoan seventeen earthquake adidas
646,ki23 diartikan jokowi sdg bermamemenipulasi prabowo benteng dr pihak2 ingin menguak mamemenipulasi,angelbingit,Capres,Fri Dec 15 04:07:38 +0000 2023,KI23 is interpreted by Jokowi SDG in the management of Prabowo Benteng from the parties want
647,erizandra pemakluman bab ibadah au dah om puyeng,JHPrabowo,Capres,Fri Dec 15 04:07:37 +0000 2023,Ferizandra Pemable of Au Worship Chapter Dah Om Dizzy
648,imberley 2024 ketawa mbak lucu mbaknya spt pak prabowo tp tidak cari pemimpin lucu hny krn punya empati trus gadaikan nasib bangsa ke orang tidak tepat empati jgn ditukar dg nasib bangsa,arya_balikang,Capres,Fri Dec 15 04:07:31 +0000 2023,Kimberley 2024 Laughing Ms. Funny Miss is like Pak Prabowo but not looking for funny leaders only because they have empathy and then pawn the fate of the nation to people inappropriate not to be exchanged with the fate of the nation
649,aku yakin banget deh sama pak prabowo,robiiskand___9,Capres,Fri Dec 15 04:07:24 +0000 2023,I'm really sure with Mr. Prabowo
