Unnamed: 0,created_at,id_str,full_text,quote_count,reply_count,retweet_count,favorite_count,lang,user_id_str,conversation_id_str,username,tweet_url,Kategori
0,Fri Dec 15 04:04:44 +0000 2023,1.7355111797816568e+18,"@dedy_pram Pastilah, Prabowo Anies nggak punya prestasi...",0.0,0,0.0,0.0,in,797761417894051840,1.7351471247347878e+18,MarahIchsan,https://twitter.com/MarahIchsan/status/1735511179781656951,Capres
1,Fri Dec 15 04:04:33 +0000 2023,1.7355111362028134e+18,Suasana pedesaan memang selalu menyenangkan... udara segar dengan rimbunnya tumbuhan hijau... sungai jernih penuh ikan-ikan kecil sampai besar yg menarik ...  Angin Dieng yg Gacoan Adidas Semalem bukan Ordal Anies https://t.co/7BXHMzo2Kn,0.0,0,0.0,0.0,in,936445409605459968,1.7355111362028134e+18,Agung_wiyo,https://twitter.com/Agung_wiyo/status/1735511136202813536,Capres
2,Fri Dec 15 04:04:31 +0000 2023,1.7355111275248517e+18,Program anies hanyalah mengubah nama rumah sakit se Indonesia wkwk!!  JUNGKOOK IS COMING olivia Gacoan Daesang BANGTAN DEBUT Karina #BABYMONSTER #DeathsGame Wonbin BATTER UP 100M VIEWS https://t.co/q63OMtb3Ka,0.0,0,0.0,0.0,in,768652236,1.7355111275248517e+18,Alfakton_i,https://twitter.com/Alfakton_i/status/1735511127524851742,Capres
3,Fri Dec 15 04:04:27 +0000 2023,1.735511110340825e+18,@kumparan @aniesbaswedan anies... BERBOHONG DAN NIPU TANPA RASA BERSALAH,0.0,0,0.0,0.0,in,1710823909275410432,1.7351458618969254e+18,justtheway333,https://twitter.com/justtheway333/status/1735511110340825410,Capres
4,Fri Dec 15 04:04:26 +0000 2023,1.73551110563054e+18,Tidak Bicara Sesuai Fakta! Anies Dengan Lantang Sebut Lampung Tidak Mempunyai Alat Pemantau Polusi Udara   Gacoan | Anies | gempa | Daesang | Pagii | BATTER UP 100M VIEWS | pilihan terbaik | #SUHOinAAA | #NightHasComeEp8 | #NCTDREAMxSALMASALSABIL https://t.co/9ubCGtY30v,0.0,0,1.0,1.0,in,1661757337554784264,1.7355111030468936e+18,singgihabdrchmn,https://twitter.com/singgihabdrchmn/status/1735511105630540090,Capres
5,Fri Dec 15 04:04:25 +0000 2023,1.7355111030468936e+18,"Prabowo Sindir Anies Baswedan: APBD Paling Besar, Tapi Kok Mas Anies Gagal Memimpin Jakarta!  Gacoan | Anies | gempa | Daesang | Pagii | BATTER UP 100M VIEWS | pilihan terbaik | #SUHOinAAA | #NightHasComeEp8 | #NCTDREAMxSALMASALSABIL https://t.co/5ftxD8kCsB",0.0,1,1.0,1.0,in,1661757337554784264,1.7355111030468936e+18,singgihabdrchmn,https://twitter.com/singgihabdrchmn/status/1735511103046893580,Capres
6,Fri Dec 15 04:04:15 +0000 2023,1.7355110599252298e+18,"@hasyimmah Alesan harus jelas dan pak anies sudah menjelaskan sejelas jelas nya,masih engga paham?dungu berarti",0.0,0,0.0,1.0,in,3157194798,1.735191540715459e+18,7f33229758ab489,https://twitter.com/7f33229758ab489/status/1735511059925229872,Capres
7,Fri Dec 15 04:04:13 +0000 2023,1.7355110493220255e+18,@brochandra @ainunnajib Wow mantap sekali. Apakah ini artinya bro Anies akan menjadi presiden RI?,0.0,0,0.0,0.0,in,353739058,1.7354527500022172e+18,MisterMarmut,https://twitter.com/MisterMarmut/status/1735511049322025409,Capres
8,Fri Dec 15 04:04:12 +0000 2023,1.7355110487180452e+18,"@ajengcute16__ saya dulu belajar majas  kelas 8 SMP,saya paham apa yang dibilang pak anies. kalo yang ga paham mungkin belum mengenyam kelas 8.",0.0,0,0.0,0.0,in,1410420836499066883,1.7351535910638144e+18,id_edx,https://twitter.com/id_edx/status/1735511048718045241,Capres
9,Fri Dec 15 04:04:03 +0000 2023,1.7355110081046203e+18,"@tvOneNews Kasian kiki, padahal itu fakta, memang si anies jago berkata kata saja demi menarik simpati, padahal implementasinya dijamin NOL. Cth waktu jd mentri dan gubernur aja, kerja nya standar banget. #AniesMuhaimin2024 #AMIN",0.0,0,0.0,0.0,in,1596864352174604288,1.7354652135358917e+18,bimasakti_2013,https://twitter.com/bimasakti_2013/status/1735511008104620433,Capres
10,Fri Dec 15 04:04:00 +0000 2023,1.7355109954503887e+18,@strike_bravo_b anaknya anies cakep bener. dua anak capres yang mukanya ga tengil. 😂😂,0.0,0,0.0,1.0,in,743346458871488513,1.735508463508484e+18,FrankSudiro,https://twitter.com/FrankSudiro/status/1735510995450388662,Capres
11,Fri Dec 15 04:03:57 +0000 2023,1.735510983098106e+18,"@detikcom Partai yg mendukung pak Anies juga tdk tahan menjadi oposisi,Nasdem dan PKB tuh msh ada yg jabat mentri dan Imin msh jabat wakil ketua DPRRI nampaknya betah banget dgn kekuasaan,MUNDUR DONG",0.0,0,0.0,0.0,in,1395713255637585923,1.7355099912079365e+18,Budionotaslim3,https://twitter.com/Budionotaslim3/status/1735510983098105976,Capres
12,Fri Dec 15 04:03:57 +0000 2023,1.7355109821125266e+18,@blakcrws @ciroooo17 @abu_mahdzuroh Lah dia juga dulu dukung Prabowo yg lebih liberal dari Anies 🤣  HRS itu lebih ke anti jokowi-pdip sejak kasus ahok 😂,0.0,0,0.0,0.0,in,1587433143724044289,1.73527044957848e+18,milktearoll,https://twitter.com/milktearoll/status/1735510982112526577,Capres
13,Fri Dec 15 04:03:55 +0000 2023,1.7355109769451812e+18,"@zenrs Asli rada hoream euy, ceunah kebebasan berpendapat. Sugan teh geus balik deui jadi Anies era Nurcholis Madjid Memorial Lecture..",0.0,0,0.0,0.0,in,880952622143815680,1.7355000759616184e+18,chandraknows,https://twitter.com/chandraknows/status/1735510976945181142,Capres
14,Fri Dec 15 04:03:53 +0000 2023,1.735510969391231e+18,Tidak Bicara Sesuai Fakta! Anies Dengan Lantang Sebut Lampung Tidak Mempunyai Alat Pemantau Polusi Udara   Gacoan | Anies | gempa | Daesang | Pagii | BATTER UP 100M VIEWS | pilihan terbaik | #SUHOinAAA | #NightHasComeEp8 | #NCTDREAMxSALMASALSABIL https://t.co/tRKFoSFe2g,0.0,0,1.0,1.0,in,1661666670648397831,1.7355109666690662e+18,AlirizaOctarina,https://twitter.com/AlirizaOctarina/status/1735510969391231101,Capres
15,Fri Dec 15 04:03:53 +0000 2023,1.7355109666690662e+18,"Prabowo Sindir Anies Baswedan: APBD Paling Besar, Tapi Kok Mas Anies Gagal Memimpin Jakarta!  Gacoan | Anies | gempa | Daesang | Pagii | BATTER UP 100M VIEWS | pilihan terbaik | #SUHOinAAA | #NightHasComeEp8 | #NCTDREAMxSALMASALSABIL https://t.co/md7FP2HoqF",0.0,1,1.0,1.0,in,1661666670648397831,1.7355109666690662e+18,AlirizaOctarina,https://twitter.com/AlirizaOctarina/status/1735510966669066276,Capres
16,Fri Dec 15 04:03:43 +0000 2023,1.735510926038856e+18,Itu yang bilang Anies modal kata doang tapi pacarannya di Eco Park Tebet musuhin aja,0.0,0,0.0,0.0,in,1014773160011395072,1.735510926038856e+18,visav99,https://twitter.com/visav99/status/1735510926038856059,Capres
17,Fri Dec 15 04:03:41 +0000 2023,1.735510916551381e+18,@imanlagi Tapi sayangnya kebanyakan msh pendukung anies yg dateng mas. Baru yg di lampung kemaren berani bgt.  Tapi ya mereka juga kayaknya bisa dibilang takut sih kalo hadepan lgsg buat desak anies wkwk,0.0,0,0.0,0.0,in,1361747261818949632,1.7355092710000888e+18,dolken234,https://twitter.com/dolken234/status/1735510916551381115,Capres
18,Fri Dec 15 04:03:37 +0000 2023,1.735510898473845e+18,@nur595912246375 @jansen_jsp @PDemokrat Anies dan PKS,0.0,0,0.0,0.0,in,1531651010292199424,1.7352520691568684e+18,Aby_zaky_,https://twitter.com/Aby_zaky_/status/1735510898473844903,Capres
19,Fri Dec 15 04:03:33 +0000 2023,1.73551088516957e+18,Gerindra Bantah soal Anies Bilang Prabowo Bisnisnya Macet Gegara Jadi Oposisi  https://t.co/eCtiuAJFsg,0.0,0,0.0,0.0,in,788744100,1.73551088516957e+18,Riau24Com,https://twitter.com/Riau24Com/status/1735510885169570172,Capres
20,Fri Dec 15 04:03:31 +0000 2023,1.7355108736520236e+18,"@dhemit_is_back Anies ikut dalam menguburkan Harun tahun 2019, ada beritanya itu. Apakah masih dikatakan HOAX padahal beliau ikut dalam penguburannya.",0.0,0,0.0,0.0,in,1709037131220611072,1.7355063684745175e+18,nameItAllSarah,https://twitter.com/nameItAllSarah/status/1735510873652023642,Capres
21,Fri Dec 15 04:03:29 +0000 2023,1.7355108660058358e+18,Anies Baswedan menjawab pertanyaan debat dengan bukti nyata kinerja yang sangat memuaskan.,0.0,0,0.0,0.0,in,1698967732455366656,1.7355108660058358e+18,wavetoraln,https://twitter.com/wavetoraln/status/1735510866005835831,Capres
22,Fri Dec 15 04:03:26 +0000 2023,1.7355108553481057e+18,"@kangmaspri @tobenaccro Anies tuh cerdas, terutama soal janji transportasi, jaklingko, dan mau rekrut pak iganisus pula. pemilih dia sudah banyak tadi nya, kurang bijak aja kenapa harus bawa² ulama, Gimana kalo pendeta/pastor/pemimpin agama lain juga di pertimbangkan opini nya? kenapa hanya cuman ulama",0.0,0,0.0,0.0,in,1443581379657093129,1.73547727479815e+18,sofiamarahmarah,https://twitter.com/sofiamarahmarah/status/1735510855348105423,Capres
23,Fri Dec 15 04:03:24 +0000 2023,1.735510845860549e+18,"@Dahnilanzar karakter wowo vs anies jauhlah lah bang....mbok legowo aja..Anies dapat simpati publik meluas sedang wowo sebaliknya.....sesederhana itu dipahaminya....jgn sampai kita jd parasocial relationship disorder""""",0.0,0,0.0,0.0,in,1238501999567486977,1.735228668971254e+18,ahmadba83911331,https://twitter.com/ahmadba83911331/status/1735510845860549115,Capres
24,Fri Dec 15 04:03:23 +0000 2023,1.7355108420731087e+18,"@savicali Kalau kita = ga bisa kerja di bidang nya tapi jago nyindir orang lain, anies?",0.0,0,0.0,0.0,in,36875940,1.7354854188949714e+18,yogi_Halim,https://twitter.com/yogi_Halim/status/1735510842073108772,Capres
25,Fri Dec 15 04:03:20 +0000 2023,1.7355108291336806e+18,"@andre_rosiade Paragraf satu udah dijelasin sama Pa Anies sendiri. Tonton geh videonya. Biar paham konteks. Ape2 ditelen mentah2.  Paragraf kedua, itu namanya pamrih. Katanya paling ikhlas? Ko diungkit lagi? Ko nyapres lagi?  Paragraf ketiga, etika katanya bro awokwokwok mending ngaca dulu dah",0.0,0,0.0,0.0,in,1625477489245171714,1.735204525517177e+18,ontonowhere,https://twitter.com/ontonowhere/status/1735510829133680704,Capres
26,Fri Dec 15 04:03:18 +0000 2023,1.735510818601804e+18,Tidak Bicara Sesuai Fakta! Anies Dengan Lantang Sebut Lampung Tidak Mempunyai Alat Pemantau Polusi Udara   Gacoan | Anies | gempa | Daesang | Pagii | BATTER UP 100M VIEWS | pilihan terbaik | #SUHOinAAA | #NightHasComeEp8 | #NCTDREAMxSALMASALSABIL https://t.co/IzWK82Tb4u,0.0,0,1.0,1.0,in,1648504180871684101,1.7355108155315656e+18,dsukinah,https://twitter.com/dsukinah/status/1735510818601804091,Capres
27,Fri Dec 15 04:03:17 +0000 2023,1.7355108155315656e+18,"Prabowo Sindir Anies Baswedan: APBD Paling Besar, Tapi Kok Mas Anies Gagal Memimpin Jakarta!  Gacoan | Anies | gempa | Daesang | Pagii | BATTER UP 100M VIEWS | pilihan terbaik | #SUHOinAAA | #NightHasComeEp8 | #NCTDREAMxSALMASALSABIL https://t.co/ZHEpLQ7F2a",0.0,1,1.0,1.0,in,1648504180871684101,1.7355108155315656e+18,dsukinah,https://twitter.com/dsukinah/status/1735510815531565456,Capres
28,Fri Dec 15 04:03:15 +0000 2023,1.7355108074700393e+18,"@aldapstsr Oh itu anaknya Anies, emang cantik banget. Senyumnya apalagi",0.0,0,0.0,0.0,in,1641775330263465984,1.735338899130778e+18,jongwonrp,https://twitter.com/jongwonrp/status/1735510807470039380,Capres
29,Fri Dec 15 04:03:14 +0000 2023,1.7355108053603292e+18,Anies selalu berkomitmen untuk mewujudkan perubahan positif demi kebaikan masyarakatnya dan negaranya. https://t.co/TdCz876agg,0.0,0,0.0,0.0,in,1698967732455366656,1.7355108053603292e+18,wavetoraln,https://twitter.com/wavetoraln/status/1735510805360329199,Capres
30,Fri Dec 15 04:03:13 +0000 2023,1.7355107997441065e+18,"Kemenangan Anies di gub DKI, di klaim penuh oleh prabowo dan gerindra, baik dari dukungan dan modal logistik, menurut @andre_rosiade .   Sungguh kesombongan, dengan menghilangkan jasa2 dari partai2 lain, relawan2 dan rakyat DKI di pilgub DKI. Mereka lebih berjasa",0.0,0,0.0,0.0,in,145959630,1.7355107997441065e+18,seven7_7up,https://twitter.com/seven7_7up/status/1735510799744106523,Capres
31,Fri Dec 15 04:03:12 +0000 2023,1.7355107964138537e+18,"Selama masa jabatannya sebagai Gubernur, Anies  telah memimpin berbagai proyekpembangunan untuk kesejahteraan rakyatnya.",0.0,0,0.0,0.0,in,1698967732455366656,1.7355107964138537e+18,wavetoraln,https://twitter.com/wavetoraln/status/1735510796413853742,Capres
32,Fri Dec 15 04:03:07 +0000 2023,1.7355107756729958e+18,Anies Baswedan mengajak warganya untuk menunjukkan kekuatan bangsa dengan semangat perjuangan.,0.0,0,0.0,0.0,in,1698967732455366656,1.7355107756729958e+18,wavetoraln,https://twitter.com/wavetoraln/status/1735510775672995960,Capres
33,Fri Dec 15 04:03:02 +0000 2023,1.7355107517655578e+18,Pemikiran Anies dalam debat perdananya Tidak sedikit yang mampu menciptakan perubahan positif di masyarakat.,0.0,0,0.0,0.0,in,1698967732455366656,1.7355107517655578e+18,wavetoraln,https://twitter.com/wavetoraln/status/1735510751765557661,Capres
34,Fri Dec 15 04:03:01 +0000 2023,1.7355107496137897e+18,"@ndaphie8 @ekowboy2 Anies angkat alis nggak ada,dan nggak pernah yg ada itu menggunakan fakedeep AI🤣🤣🤣🤣dasar para buzzer polri sukanya buat fitnah",0.0,0,0.0,0.0,in,3006251442,1.7352420898884652e+18,zainalarifin083,https://twitter.com/zainalarifin083/status/1735510749613789569,Capres
35,Fri Dec 15 04:02:58 +0000 2023,1.7355107350470413e+18,2019 anies jd gubernur dan ikut pilpres krn ada prabowo. 2024 anies dicalonkan nasdem apa salahnya? Nasdem jeli krn negara butuh sosok seperti anies dan rakyat INGIN PERUBAHAN untuk KEADILAN SOSIAL BAGI SELURUH RAKYAT INDONESIA.  #2024ANIESIMIN #2024ANIESIMIN,0.0,0,0.0,0.0,in,1543593106171625473,1.7355107350470413e+18,Adam03072022,https://twitter.com/Adam03072022/status/1735510735047041283,Capres
36,Fri Dec 15 04:02:57 +0000 2023,1.735510730852762e+18,"Dengan berbagai inisiatifnya dalam mengembangkan Jakarta, Anies telah menjadi contoh nyata bagi banyak orang",0.0,0,0.0,0.0,in,1698967732455366656,1.735510730852762e+18,wavetoraln,https://twitter.com/wavetoraln/status/1735510730852762049,Capres
37,Fri Dec 15 04:02:57 +0000 2023,1.735510730697511e+18,@kumparan @aniesbaswedan ordal anies profesional dan berintegritas,0.0,0,0.0,0.0,in,1636159842363768833,1.7351458618969254e+18,FierCollec6141,https://twitter.com/FierCollec6141/status/1735510730697510968,Capres
38,Fri Dec 15 04:02:55 +0000 2023,1.7355107238523745e+18,@Paltiwest @dee__1209 Anies Baswedan dan Muhaimin Iskandar dong .. Untuk Indonesia Lebih Baik,0.0,0,0.0,0.0,in,1610923700240650241,1.735146150712517e+18,tj_harianto,https://twitter.com/tj_harianto/status/1735510723852374145,Capres
39,Fri Dec 15 04:02:51 +0000 2023,1.735510708991992e+18,"Dalam debat, Ada banyak buah pemikiran Anies yang pada akhirnya memang benar-benar bermanfaat untuk pencerdasan warga negara. https://t.co/L5QX6Dlnnv",0.0,0,0.0,0.0,in,1698967732455366656,1.735510708991992e+18,wavetoraln,https://twitter.com/wavetoraln/status/1735510708991992091,Capres
40,Fri Dec 15 04:02:51 +0000 2023,1.73551070572465e+18,@saludosparatii @fullmoonfolks Udah rahasia umum lah. Ga usah ditutupi bagaimana Anies menikmati politik identitas ini. Dia betul-betul ambil Untung,0.0,0,0.0,0.0,in,314965741,1.7353243724943652e+18,Fahmy_TEGAL,https://twitter.com/Fahmy_TEGAL/status/1735510705724649868,Capres
41,Fri Dec 15 04:02:49 +0000 2023,1.7355107007331576e+18,"Anies Baswedan Dituding Capres Banyak Janji, Timnas AMIN: Janji Kita Terukur!  https://t.co/YvnQ6tiYgx",0.0,0,0.0,0.0,in,1592886017446793218,1.7355107007331576e+18,polhukamid_,https://twitter.com/polhukamid_/status/1735510700733157591,Capres
42,Fri Dec 15 04:02:45 +0000 2023,1.735510682215555e+18,Anies telah mendedikasikan dirinya untuk membangun Jakarta menjadi kota yang,,,,,,,,,,Capres
maju. https://t.co/4W1EL87zUr,0,0.0,0,0.0,in,1.698967732455367e+18,1.735510682215555e+18,wavetoraln,https://twitter.com/wavetoraln/status/1735510682215555366,,,,Capres
43,Fri Dec 15 04:02:41 +0000 2023,1.7355106657277916e+18,"@Raden_Mas_Budi @Heraloebss Hanya org² cerdas yg paham apa yg disampaikan pak anies.   Tapi klo otaknya cetek, males mikir, pasti penilaiannya njelimet 😄🤣",0.0,0,0.0,0.0,in,3329869879,1.7352895343368689e+18,SubhanDanil,https://twitter.com/SubhanDanil/status/1735510665727791513,Capres
44,Fri Dec 15 04:02:41 +0000 2023,1.7355106641549071e+18,Tidak Bicara Sesuai Fakta! Anies Dengan Lantang Sebut Lampung Tidak Mempunyai Alat Pemantau Polusi Udara   Gacoan | Anies | gempa | Daesang | Pagii | BATTER UP 100M VIEWS | pilihan terbaik | #SUHOinAAA | #NightHasComeEp8 | #NCTDREAMxSALMASALSABIL https://t.co/qzPIthUfzr,0.0,0,1.0,1.0,in,1648500391741632515,1.7355106616299318e+18,aryaawiigunaa,https://twitter.com/aryaawiigunaa/status/1735510664154907045,Capres
45,Fri Dec 15 04:02:40 +0000 2023,1.7355106616299318e+18,"Prabowo Sindir Anies Baswedan: APBD Paling Besar, Tapi Kok Mas Anies Gagal Memimpin Jakarta!  Gacoan | Anies | gempa | Daesang | Pagii | BATTER UP 100M VIEWS | pilihan terbaik | #SUHOinAAA | #NightHasComeEp8 | #NCTDREAMxSALMASALSABIL https://t.co/68t7N26QZJ",0.0,1,1.0,1.0,in,1648500391741632515,1.7355106616299318e+18,aryaawiigunaa,https://twitter.com/aryaawiigunaa/status/1735510661629931741,Capres
46,Fri Dec 15 04:02:40 +0000 2023,1.73551066147054e+18,Anies telah,,,,,,,,,,Capres
membuktikan dirinya sebagai pemimpin yang berfokus pada mencari solusi bagi permasalahan,,,,,,,,,,,,,Capres
yang dihadapi oleh kota Jakarta. https://t.co/iCEMtZtMXc,0,0.0,0,0.0,in,1.698967732455367e+18,1.73551066147054e+18,wavetoraln,https://twitter.com/wavetoraln/status/1735510661470540157,,,,Capres
47,Fri Dec 15 04:02:40 +0000 2023,1.7355106603255565e+18,"@Tan_Mar3M BuzzerRp paslon no 2 sudah kehabisan akal &amp  narasi untuk serang ANIES, makanya pakai methode Fitnah recehan.",0.0,0,0.0,0.0,in,518191393,1.7355037803960325e+18,antaz345,https://twitter.com/antaz345/status/1735510660325556444,Capres
48,Fri Dec 15 04:02:32 +0000 2023,1.735510628427862e+18,"Anies membangun Jakarta yang lebih berkelanjutan, ramah lingkungan,dan memastikan bahwa pertumbuhan kota memberikan manfaat bagi seluruh warga. https://t.co/mqCglWHP1s",0.0,0,0.0,0.0,in,1698967732455366656,1.735510628427862e+18,wavetoraln,https://twitter.com/wavetoraln/status/1735510628427862052,Capres
49,Fri Dec 15 04:02:32 +0000 2023,1.735510625831502e+18,"@andre_rosiade Janji sdh tdk ditunaikan tdk nyapres selama masa @aniesbaswedan jabat Gub. DKI kalau sdh selesai ya selesailah janjinya (mission accomplished). Smp kpn pak Anies boleh nyapres kl tiap priode @prabowo kalah² terus &amp  nyapres² terus? Etika koyol, tau!",0.0,0,0.0,0.0,in,90842269,1.735204525517177e+18,t0d1_cool,https://twitter.com/t0d1_cool/status/1735510625831501990,Capres
50,Fri Dec 15 04:02:25 +0000 2023,1.735510596609868e+18,@geloraco Foodeatate gagal.. pesawat tempur rongsokan..hutang Kemenhan trilyunan adalah bentuk kebengisan pada 270 juta lebih rakyat Indonesia. Saya sarankan tim TKN tolong banyak² bercermin sebelum menyerang pak Anies. Akhlak kalian sudah pada benar ya.,0.0,0,0.0,0.0,in,1626070342132445185,1.7354736067744358e+18,UmmiYusniar,https://twitter.com/UmmiYusniar/status/1735510596609867946,Capres
51,Fri Dec 15 04:02:24 +0000 2023,1.7355105928098284e+18,"@yogi_bubu @masakanrasako ga bang aman, anies pernah tegor rijik suruh bayar denda kok waktu buat kerumunan pas covid itu buktinya!",0.0,0,0.0,0.0,in,1033361979501473795,1.7354907163135716e+18,rihan_ribi,https://twitter.com/rihan_ribi/status/1735510592809828404,Capres
52,Fri Dec 15 04:02:24 +0000 2023,1.7355105921806254e+18,"@do_adoo @qronoz Gw lagi gak bahas DKI. Setelah debat, jujur gw udah melunak sama Anies dan siap menerima kemungkinan dia jadi Presiden.  Gw ngomong gitu setelah baca ttg berita Kontrak Politik.   Anyway, seperti di twit awal gw, DKI ≠ Negara.",0.0,1,0.0,0.0,in,194930736,1.7352915156800064e+18,footycinephile,https://twitter.com/footycinephile/status/1735510592180625422,Capres
53,Fri Dec 15 04:02:17 +0000 2023,1.735510565060227e+18,@m_indra_kurnia @PrabuSantoso1 @sobat_anies @PartaiSocmed Iya. Tapi kok disurvey. Kok bisa unggul ya,0.0,0,0.0,0.0,in,1682584140821184515,1.7352861267081503e+18,riyanto442799,https://twitter.com/riyanto442799/status/1735510565060227189,Capres
54,Fri Dec 15 04:02:15 +0000 2023,1.7355105565248883e+18,"@ch_chotimah2 Buni yani mengatakan yang memotong video pidato Ahok adalah tim cybernya Prabowo. Jadi ketimbang Anies yg tak punya masa, maka yg lebih bertanggungjawab seharusnya Prabowo yg menggerakan kelompok brutal 212...",0.0,0,0.0,1.0,in,1333338628383068161,1.7352169628323515e+18,DylanBr03197352,https://twitter.com/DylanBr03197352/status/1735510556524888381,Capres
55,Fri Dec 15 04:02:14 +0000 2023,1.7355105528380746e+18,@Muhammad_Saewad La emang pengusung anies pkb nasdem oposisi?,0.0,0,0.0,0.0,in,1330887554929868800,1.7345754552385866e+18,Bobon589,https://twitter.com/Bobon589/status/1735510552838074680,Capres
56,Fri Dec 15 04:02:11 +0000 2023,1.7355105395337462e+18,@bukanbuzzerRp @PartaiSocmed buzzer anies yang follower ribuan juga klo tweet di bayar ya?,0.0,0,0.0,0.0,in,1709392924486823936,1.735215245139067e+18,pecandujudi,https://twitter.com/pecandujudi/status/1735510539533746261,Capres
57,Fri Dec 15 04:02:11 +0000 2023,1.7355105384348265e+18,Tidak Bicara Sesuai Fakta! Anies Dengan Lantang Sebut Lampung Tidak Mempunyai Alat Pemantau Polusi Udara   Gacoan | Anies | gempa | Daesang | Pagii | BATTER UP 100M VIEWS | pilihan terbaik | #SUHOinAAA | #NightHasComeEp8 | #NCTDREAMxSALMASALSABIL https://t.co/phrHdZxWUT,0.0,0,1.0,1.0,in,1648498308527304712,1.735510535423337e+18,bagasangkas,https://twitter.com/bagasangkas/status/1735510538434826490,Capres
58,Fri Dec 15 04:02:10 +0000 2023,1.735510535423337e+18,"Prabowo Sindir Anies Baswedan: APBD Paling Besar, Tapi Kok Mas Anies Gagal Memimpin Jakarta!  Gacoan | Anies | gempa | Daesang | Pagii | BATTER UP 100M VIEWS | pilihan terbaik | #SUHOinAAA | #NightHasComeEp8 | #NCTDREAMxSALMASALSABIL https://t.co/Lbvw4f00d9",0.0,1,1.0,1.0,in,1648498308527304712,1.735510535423337e+18,bagasangkas,https://twitter.com/bagasangkas/status/1735510535423336919,Capres
59,Fri Dec 15 04:02:08 +0000 2023,1.7355105282216428e+18,"@chadlvn @ARSIPAJA Anies bagus sebenernya itu kuncinya sih ka. Yg belakang jg ga bisa ngapa2in, kecuali kalau aniesnya yg busuk baru bahaya. Kalau presiden skrg saya ga berani komen yg kasar, khawatir knp2.",0.0,0,0.0,0.0,in,1313013142851477504,1.7353047729815186e+18,beyoubeau,https://twitter.com/beyoubeau/status/1735510528221642864,Capres
60,Fri Dec 15 04:02:08 +0000 2023,1.7355105262293732e+18,@BosPurwa Gak layak jadi presiden' pantesan gak pernah menang ..... Dulu saya dukung karena hanya 2 pilihan.... Sekarang Anies paling layak dari semuanya,0.0,0,0.0,0.0,in,1177801937783099393,1.7348533746953546e+18,SoniS81984310,https://twitter.com/SoniS81984310/status/1735510526229373275,Capres
61,Fri Dec 15 04:02:01 +0000 2023,1.735510497984926e+18,"@TaufikRendusara Dulu sih 2 kali milih dia, sekarang sih udah makin yakin pilih Anies 👍👍 https://t.co/ZxMw7Z2mQI",0.0,0,0.0,1.0,in,58707978,1.7351867715232975e+18,arifienz,https://twitter.com/arifienz/status/1735510497984926073,Capres
62,Fri Dec 15 04:01:50 +0000 2023,1.7355104531392187e+18,"Anies Baswedan Dituding Capres Banyak Janji, Timnas AMIN: Janji Kita Terukur! https://t.co/4e00XR8bE6",0.0,0,0.0,0.0,in,1662344532627976192,1.7355104531392187e+18,geloradotnews,https://twitter.com/geloradotnews/status/1735510453139218607,Capres
63,Fri Dec 15 04:01:49 +0000 2023,1.7355104475145997e+18,"Anies Baswedan Dituding Capres Banyak Janji, Timnas AMIN: Janji Kita Terukur! https://t.co/xwyROT10Fn",0.0,0,0.0,0.0,in,1466815910518263808,1.7355104475145997e+18,idtodaycoid,https://twitter.com/idtodaycoid/status/1735510447514599609,Capres
64,Fri Dec 15 04:01:42 +0000 2023,1.7355104190565012e+18,Wkwkwk pendukung Anies kek gini,0.0,0,0.0,0.0,in,1370604191052263427,1.7355104190565012e+18,selow_mas,https://twitter.com/selow_mas/status/1735510419056501239,Capres
65,Fri Dec 15 04:01:40 +0000 2023,1.7355104109782756e+18,"@VIVAcoid Waktu debat perdana, Pak Anies menunjukkan sebagai politisi yang intelek dengan setelan jas dan peci",0.0,0,0.0,0.0,in,1698967732455366656,1.7348964672556242e+18,wavetoraln,https://twitter.com/wavetoraln/status/1735510410978275492,Capres
66,Fri Dec 15 04:01:39 +0000 2023,1.735510406096122e+18,@bungdree @tvOneNews @kikysaputrii @aniesbaswedan Yg disampaikan kiky malah bagus kok. Justru memuji anies,0.0,0,0.0,0.0,in,107559359,1.7350644461193997e+18,shafirgora,https://twitter.com/shafirgora/status/1735510406096121862,Capres
67,Fri Dec 15 04:01:37 +0000 2023,1.735510396285616e+18,"@VIVAcoid Terlihat dalam debat, Anies selalu memilikikemampuan merancang dan menerapkan solusi-solusi kreatif.",0.0,0,0.0,0.0,in,1698967732455366656,1.7348964672556242e+18,wavetoraln,https://twitter.com/wavetoraln/status/1735510396285616144,Capres
68,Fri Dec 15 04:01:34 +0000 2023,1.7355103853889132e+18,"@VIVAcoid Selama debat, Anies memiliki banyak solusi mengenai masalah ketimpangan yang terjadi di Indonesia.",0.0,0,0.0,0.0,in,1698967732455366656,1.7348964672556242e+18,wavetoraln,https://twitter.com/wavetoraln/status/1735510385388913059,Capres
69,Fri Dec 15 04:01:32 +0000 2023,1.735510377491002e+18,Tidak Bicara Sesuai Fakta! Anies Dengan Lantang Sebut Lampung Tidak Mempunyai Alat Pemantau Polusi Udara   Gacoan | Anies | gempa | Daesang | Pagii | BATTER UP 100M VIEWS | pilihan terbaik | #SUHOinAAA | #NightHasComeEp8 | #NCTDREAMxSALMASALSABIL https://t.co/vmMBn6nQQa,0.0,0,1.0,1.0,in,1648495361353482242,1.735510374693405e+18,roziiputraa,https://twitter.com/roziiputraa/status/1735510377491001795,Capres
70,Fri Dec 15 04:01:32 +0000 2023,1.735510374693405e+18,"Prabowo Sindir Anies Baswedan: APBD Paling Besar, Tapi Kok Mas Anies Gagal Memimpin Jakarta!  Gacoan | Anies | gempa | Daesang | Pagii | BATTER UP 100M VIEWS | pilihan terbaik | #SUHOinAAA | #NightHasComeEp8 | #NCTDREAMxSALMASALSABIL https://t.co/93yTT01LL9",0.0,1,1.0,1.0,in,1648495361353482242,1.735510374693405e+18,roziiputraa,https://twitter.com/roziiputraa/status/1735510374693404951,Capres
71,Fri Dec 15 04:01:32 +0000 2023,1.7355103741145746e+18,"@VIVAcoid Selama debat nya, Anies memperkenalkan program-program untuk solusidari masalah yang ada seperti dalam penididikan, transportasi, lingkungan.",0.0,1,0.0,0.0,in,1698967732455366656,1.7348964672556242e+18,wavetoraln,https://twitter.com/wavetoraln/status/1735510374114574703,Capres
